re_tweeter,links,author,text,hashtags,reply_count,associated_tweet,timestamp,mentions,author_id,retweet_count,type,id,favorite_count
,,CZ  Binance,"This other time, was a @Binance Super Meetup in Taiwan (hot). I was rushing back from another venue, I could make the 1000+ people wait for a few minutes (very expensive in time), or... Probably won't be the last time. I hate shorts in trading, but love them on my legs.",,,,1623817633,,,,Tweet,1405019103983775744,
,,CZ  Binance,In my (weak) defense Shorts (often called Bermudas) with high socks are formal wear in Bermuda. I went with @BermudaPremier's aide the day before to specifically buy it for the occasion. It just turned out everyone else was wearing long pants.,,,,1623816920,,,,Tweet,1405016116754149376,
,,CZ  Binance,I don't think I have authority to comment on this.,,,,1623816626,,,,Tweet,1405014883037454336,
,,CZ  Binance,"TodayQ: CZ, what's difference between crypto now vs 2017?Me: well, for one thing, back in 2017, no one on CT (crypto twitter) had more than 300k followers.",,,,1623816314,,,,Tweet,1405013575471489024,
,['https:\\/\\/t.co\\/RUE0XvojVq'],CZ  Binance,"Keep building; keep creating.>Binance launching NFTs from street artist Lushsux, Carlton's Eddie Betts and 6 other Aussies - Stockhead",,,,1623811182,,,,Tweet,1404992050299236352,
,,CZ  Binance,,,,,1623778671,,,,Tweet,1404855685649637376,
,,CZ  Binance,El Salvadors' purchasing power will increase over time.,,,,1623774163,,,,Tweet,1404836781007130624,
,,CZ  Binance,"Risk reminder: ""stable coins"" will lose their purchasing power over time.NFA.",,,,1623774128,,,,Tweet,1404836633661239296,
,['https:\\/\\/t.co\\/qIucDaqCSe'],CZ  Binance,"Pay in #bitcoin, people can convert to ""stable coin"" if they wish.",,,,1623773985,,,,Tweet,1404836032453906432,
,,CZ  Binance,#Bitcoin2010 I wish I got in earlier2012 I wish I got in earlier2013 I wish I got in earlier2014 I wish I got in earlier2017 I wish I got in earlier2019 I wish I got in earlier2021 I wish I got in earlier2030 I wish I got in earlier,,,,1623772387,,,,Tweet,1404829330883026944,
,,CZ  Binance,Happy birthday @APompliano,,,,1623770584,,,,Tweet,1404821766761902080,
,,CZ  Binance,Are people trying to front run @michael_saylor?,,,,1623682418,,,,Tweet,1404451974804688896,
,,CZ  Binance,Need to hire more.,,,,1623677271,,,,Tweet,1404430384729759744,
,,CZ  Binance,"How about confirming tweet responsibly ""without moving market"", too?",,,,1623606673,,,,Tweet,1404134275012694016,
,,CZ  Binance,I try not to make the same mistake twice.,,,,1623604270,,,,Tweet,1404124194695118848,
,,CZ  Binance,This was my thought in 1989.,,,,1623604218,,,,Tweet,1404123979141373952,
,,CZ  Binance,"Considering my follow (can comment on restricted tweets) vs follower ratio is 0.0005, a 0.2 ratio for the vote is something.",,,,1623603263,,,,Tweet,1404119971429437440,
,,CZ  Binance,You prefer tweets with:,,,,1623602969,,,,Tweet,1404118738534768640,
,,CZ  Binance,,,,,1623602539,,,,Tweet,1404116937689341952,
,,CZ  Binance,I am still wondering if email will largely replace postal mail. So hard to tell.,,,,1623602365,,,,Tweet,1404116208236982272,
,,CZ  Binance,,,,,1623574253,,,,Tweet,1403998296624951296,
,,CZ  Binance,"Study shows, of all the people who bought #bitcoin or #bnb, people who sold less frequently are richer.nfa.",,,,1623562361,,,,Tweet,1403948415851978752,
,,CZ  Binance,"A message is still a message, but the technology for transferring it has improved over time.Money is still money, but the technology for transferring it is improving.",,,,1623471802,,,,Tweet,1403568585411207168,
,,CZ  Binance,Will technology innovation suddenly end?No.Will #crypto suddenly end?It’s a technology.,,,,1623435809,,,,Tweet,1403417621039443968,
,,CZ  Binance,Wrong answers only. NFT stands for?,,,,1623408167,,,,Tweet,1403301681639661568,
,['https:\\/\\/t.co\\/mElkP81XUJ'],CZ  Binance,#NFTs just getting started.» Uganda Museum to Create NFTs for Display on Binance Marketplace,,,,1623390592,,,,Tweet,1403227966901874688,
,,CZ  Binance,"Contrary to popular misconceptions, #bitcoin will incentivize/fund a new era of clean energy research and development, and help further advance our civilization.",,,,1623328359,,,,Tweet,1402966943674499072,
,,CZ  Binance,"Anyone buying volcanos yet?Until 2 days ago, it just didn't cross my mind that #crypto will provide the monetization model for volcanos, too.Must admit my imagination is too limited to predict the future of #crypto, but I know it's gonna be big.nfa.",,,,1623327762,,,,Tweet,1402964437070323712,
,,CZ  Binance,"We can remove the red button for El Salvador users now, right? as selling (into fiat) is no longer necessary. They can use #bitcoin directly, the way it should be.half (lame) joke, half serious, nfa.",,,,1623259669,,,,Tweet,1402678833191342080,
,,CZ  Binance,#bitcoin -> better money -> bigger economies ->  wealthier citizens -> more (globally) influential governments -> stronger countries.Adopting #bitcoin is patriotic.,,,,1623257367,,,,Tweet,1402669178092277760,
,,CZ  Binance,Sovereign individuals use #bitcoin.Sovereign nations use #bitcoin.,,,,1623224761,,,,Tweet,1402532420528705536,
,,CZ  Binance,"If you wish to buy low and sell high, you need a low somewhere for it to work.Not financial advice.",,,,1623171235,,,,Tweet,1402307915642380288,
,,CZ  Binance,"Using #bitcoin makes your nation more sovereign.Few understand, but there are a few now at least.",,,,1623157080,,,,Tweet,1402248546645020672,
,,CZ  Binance,Don't let short term emotions take over you. Look at long term technology trends. #crypto will be everywhere in due time.NFA.,,,,1623130090,,,,Tweet,1402135339481796608,
,,CZ  Binance,"Unpopular opinion for myself: you don't have to trade/capture/sell every dip. Although not so good for exchange revenues, hodl is a usually a better strategy for most people.NFA.",,,,1623128311,,,,Tweet,1402127878083420160,
,,CZ  Binance,"A year ago today#BTC $9,790#BNB $17",,,,1623103116,,,,Tweet,1402022202405376000,
,,CZ  Binance,"Imagine if you had the power to print unlimited amounts of money to buy limited-supply assets, what would you do?True story, for some.NFA.",,,,1623057020,,,,Tweet,1401828864372862976,
,,CZ  Binance,Countries getting into #bitcoin,,,,1623056507,,,,Tweet,1401826713592500224,
,,CZ  Binance,Wait till nations start to put #bitcoin in their treasury.Or better not wait?NFA.,,,,1623055536,,,,Tweet,1401822639509827584,
,['https:\\/\\/t.co\\/X0fkDppY57'],CZ  Binance,"How Binance Takes Responsible Trading Seriously, and You Should Too | Binance Blog",,,,1623044559,,,,Tweet,1401776598290866176,
,,CZ  Binance,"And they say #crypto is hard to understand… Yes, got vaccinated.",,,,1623042655,,,,Tweet,1401768611585216512,
,,CZ  Binance,"#BNB is legal tender on #BSC, one of the most popular blockchains by daily transactions.",,,,1622988897,,,,Tweet,1401543134559936512,
,,CZ  Binance,Which country will be the next to recognize #bitcoin as a legal tender?,,,,1622985526,,,,Tweet,1401528997222109184,
,,CZ  Binance,El Salvador is beautiful!,,,,1622948306,,,,Tweet,1401372884648357888,
,,CZ  Binance,I believe Japan made #bitcoin legal tender in April 2017. Took a while for the 2nd one though.,,,,1622947012,,,,Tweet,1401367455730073600,
,,CZ  Binance,#Bitcoin  is now legal tender in El Salvador.,,,,1622946186,,,,Tweet,1401363991792742400,
,,CZ  Binance,11M Twitter and 30M Instagram followers getting to know #NFT on #BSC.,,,,1622897077,,,,Tweet,1401158014166441984,
,,CZ  Binance,The decentralized world has many different and often a bit crazy personalities. It's what makes the world interesting.,,,,1622875031,,,,Tweet,1401065545554743296,
,,CZ  Binance,"If you follow a rich crazy randomly swinging person's tweets to trade, you will end up ... not rich.NFA.",,,,1622874509,,,,Tweet,1401063355398324224,
,,CZ  Binance,Low fees => large network,,,,1622871925,,,,Tweet,1401052519397138432,
,['https:\\/\\/t.co\\/GdgCesWxSn'],CZ  Binance,#BNB,,,,1622862540,,,,Tweet,1401013155430420480,
,,CZ  Binance,History will be unkind to FUD creators and people who act on them.,,,,1622859774,,,,Tweet,1401001552614105088,
,,CZ  Binance,"Learn, and then think for yourself.",,,,1622822485,,,,Tweet,1400845153602924544,
,,CZ  Binance,I know zero rich people that became rich because they did things according to other rich people's tweet.Let that sink in.,,,,1622822380,,,,Tweet,1400844710592217088,
,['https:\\/\\/t.co\\/6Ibusb5T1m'],CZ  Binance,DeFi on WSJ.,,,,1622821075,,,,Tweet,1400839237843374080,
,,CZ  Binance,"Tweets that hurt other people's finances are not funny, and irresponsible.",,,,1622799722,,,,Tweet,1400749677322981376,
,,CZ  Binance,"Greater power with great responsibility, great. Great power with random “humor”, not great, and not funny.",,,,1622798109,,,,Tweet,1400742912523046912,
,,CZ  Binance,Don't be manipulated. #HODL Not financial advice.,,,,1622789397,,,,Tweet,1400706372765839360,
,,CZ  Binance,"Want to see photos from Miami, of real people hanging out.",,,,1622733347,,,,Tweet,1400471281108021248,
,,CZ  Binance,I am ready. #BNBNFA,,,,1622728704,,,,Tweet,1400451806627463168,
,,CZ  Binance,"Small beginnings, but #Binance Pay exceeded my expectations. I love it when this happens.",,,,1622657966,,,,Tweet,1400155108806074368,
,['https:\\/\\/t.co\\/9ARAaZCMfr'],CZ  Binance,I discovered white beard 2 days ago...,,,,1622655499,,,,Tweet,1400144761328074752,
,,CZ  Binance,Always follow the young generation.,,,,1622655253,,,,Tweet,1400143730808524800,
,,CZ  Binance,"If you have a support request @binance that was poorly handled, please drop the case id below. Will do my best to have a pass through. Maybe not be able to resolve your case, but will look for ways to improve.",,,,1622648741,,,,Tweet,1400116417907675136,
,,CZ  Binance,Just received a Certificate of Commendation from the National Police of Ukraine and Ministry of Internal Affairs from Moscow@binance works collaboratively with law enforcement agencies from all over the world to keep our space #SAFU.,,,,1622644113,,,,Tweet,1400097005834149888,
,,CZ  Binance,"For the first time in months, @binance managed to clear our level 1 customer support queue in most languages. 5x CS staff did the trick. Still working to improve the quality. Lots of new staff. Thank you for your understanding and support.",,,,1622638427,,,,Tweet,1400073157122293760,
,,CZ  Binance,"No, we are not going to 0.NFA",,,,1622638012,,,,Tweet,1400071415944990720,
,,CZ  Binance,The best performing #crypto assets have out performed all the best performing traditional assets in the last decade. Same will be true for the next decade.Not financial advice.,,,,1622574032,,,,Tweet,1399803063183953920,
,,CZ  Binance,They all have a lot of followers.,,,,1622570592,,,,Tweet,1399788637324075008,
,,CZ  Binance,"This feels like a wrong way to measure ""used at scale""? Number of users and total fees paid are usually related, but in this case, very NOT related, concepts. Google would have 0 scale using total fees paid.#BSC has much higher number of users, and much lower total fees paid.",,,,1622562309,,,,Tweet,1399753897439240192,
,,CZ  Binance,Soon soon,,,,1622555633,,,,Tweet,1399725894273544192,
,,CZ  Binance,There is a physical crypto conference going on? The world is healing.,,,,1622555484,,,,Tweet,1399725270337196032,
,,CZ  Binance,"I didn't ""buy"" crypto. That implies I view it as an asset and may ""sell"" at some point.I converted to crypto.",,,,1622475441,,,,Tweet,1399389545750155264,
,,CZ  Binance,Unpopular opinion: glad the weekend is over.,,,,1622475153,,,,Tweet,1399388335513079808,
,,CZ  Binance,#crypto unbanned?,,,,1622470153,,,,Tweet,1399367364353748992,
,['https:\\/\\/t.co\\/OLJtQQX9dj'],CZ  Binance,» How to send crypto to family and friends worldwide using Binance P2P | Binance Blog,,,,1622464936,,,,Tweet,1399345484125278208,
,,CZ  Binance,"There is a huge difference between a story teller that likes you vs one that hates you. Their opinion is always part of their ""fact-based"" story.",,,,1622463967,,,,Tweet,1399341418049531904,
,,CZ  Binance,"If some account named CZ Binance or similar contacts you to somehow give him some coins, please report that account immediately. It is a scammer, not me. Thank you! Stay #SAFU.",,,,1622446239,,,,Tweet,1399267064045465600,
,,CZ  Binance,"When you use electricity to run cars, it’s environmentally friendly.When you use electricity to run the most efficient financial networks in the world, it’s an environmental concern.",,,,1622429239,,,,Tweet,1399195759140954112,
,,CZ  Binance,"If you don’t know why you bought a coin, you won’t be able to hodl. And it you can’t hodl, you won’t be ...",,,,1622426154,,,,Tweet,1399182817955696640,
,,CZ  Binance,"If you buy a coin just because someone else tweeted about it, you don’t really know WHY they like that coin, maybe other than a high level superficial guess. Effectively, you don’t know why you bought the coin.NFA.",,,,1622426008,,,,Tweet,1399182206484893696,
,,CZ  Binance,Don’t buy a coin because someone (especially famous people) said something. Only buy coins you like yourself for some intrinsic reason.Not financial advice.,,,,1622381811,,,,Tweet,1398996831879589888,
,,CZ  Binance,"Many will happily buy at ATH again, but they won't do it now. Baffles me.Not financial advice.",,,,1622378442,,,,Tweet,1398982700929732608,
,,CZ  Binance,"If you don’t own any #bitcoin, you won’t truly understand it.",,,,1622364362,,,,Tweet,1398923645737603072,
,,CZ  Binance,#crypto is growing.,,,,1622324487,,,,Tweet,1398756396020092928,
,,CZ  Binance,What's in your bag that we should list next?,,,,1622323126,,,,Tweet,1398750688029544448,
,,CZ  Binance,"Light Sat, 9 scheduled calls only. Then a yoga lesson, first time in 20 years. Feels like it helps quite a bit. I am a late adopter to yoga.",,,,1622322885,,,,Tweet,1398749676833173504,
,,CZ  Binance,"#bitcoin doesn't change on weekends. But for some reason, it feels like the price often drop a bit on weekends. No?",,,,1622296944,,,,Tweet,1398640874939060224,
,,CZ  Binance,"The minute you provide a mini-program API, some guy develops a Red Envelop program, and tell me: ""CZ, you can give red envelops again.""  (A way to easily give money as a gift in WeChat, hugely popular.)",,,,1622193282,,,,Tweet,1398206085257863168,
,['https:\\/\\/t.co\\/UAKsVLwKT9'],CZ  Binance,Compliance solutions jumping on #BSC. » CipherTrace Adds Analytics Support for Binance Smart Chain,,,,1622188455,,,,Tweet,1398185836412162048,
,['https:\\/\\/t.co\\/l26qFkkPdO'],CZ  Binance,US market ranking. @BinanceUS,,,,1622188400,,,,Tweet,1398185606564311040,
,,CZ  Binance,"I only have one long pants. I wore it yesterday, to meet some important people. And this morning, I see a photoshoot in my calendar. And no pants, other than in the washer. Welcome to my daily life.",,,,1622175952,,,,Tweet,1398133396392452096,
,,CZ  Binance,That feeling when you dig out old pants and it’s too loose around the waist. Progress. Haha,,,,1622175532,,,,Tweet,1398131633857843200,
,,CZ  Binance,"#HODL is tough for most people. In bull markets, you are tempted to ""take profit""; In bear markets, panic sell.#HODL becomes easy after #crypto becomes your default world view. There is no take profit, no sell.",,,,1622138086,,,,Tweet,1397974575674269696,
,['https:\\/\\/t.co\\/wLhV8tDf1G'],CZ  Binance,"Live now. AMA.,",,,,1622124081,,,,Tweet,1397915833796419584,
,,CZ  Binance,There is so much going on in #crypto and #Binance ecosystems.,,,,1622089404,,,,Tweet,1397770389430804480,
,,CZ  Binance,"I wake up in the morning, and say to myself “not financial advice” before thinking to myself, just so that I don’t get into trouble with my internal monologue.",,,,1622046887,,,,Tweet,1397592057611390976,
,,CZ  Binance,"For any person/projects/tweets I retweet/like/comment/follow, even or especially the ones on #BSC, are not endorsements. If any projects claim as such, treat them as scammers. Stay #SAFU.",,,,1622046441,,,,Tweet,1397590189392883712,
,,CZ  Binance,Very good interview. A lot of in-depth details that was not discussed in other interviews.,,,,1622046202,,,,Tweet,1397589184945168384,
,,CZ  Binance,"There is an old joke in #crypto.If you missed the $200 dollar range #bnb (a couple days ago), well, don't despair, #BNB is still just $370 today. Not financial advice.",,,,1622039775,,,,Tweet,1397562229721948160,
,,CZ  Binance,"190k #BNB is sitting in the burn address, which will keep growing as people burn initial liquidity.Thats around $70m of BNB burned without any involvement from Binance.Pretty cool.",,,,1622033480,,,,Tweet,1397535824623800320,
,,CZ  Binance,"If you are not a volatility trader (ie, thrive on volatility), it is better to buy then #HODL for 5 years or longer, than actively trading.So, only use money you don't need in the next few years, and you may not need more money after that.Not financial advice.",,,,1622021437,,,,Tweet,1397485315162394624,
,,CZ  Binance,#bitcoin is not a new asset class; it is a new technology.,,,,1621966481,,,,Tweet,1397254811679027200,
,,CZ  Binance,Just a matter of time.#BTC #BNB,,,,1621960075,,,,Tweet,1397227943236145152,
,,CZ  Binance,"Not my car, but I love it. Source: just saw on @binance post.Not financial advice.",,,,1621957235,,,,Tweet,1397216031735750656,
,,CZ  Binance,Users >,,,,1621957126,,,,Tweet,1397215574724317184,
,,CZ  Binance,"live now, supposedly. :)",,,,1621952263,,,,Tweet,1397195175626215424,
,,CZ  Binance,"Always happens when your host wants to do a live interview, and the tech doesn't work.",,,,1621951910,,,,Tweet,1397193695213019136,
,,CZ  Binance,"Fear and greed are two emotions exemplified by trading. If you experienced fear a few days ago, it is time to read more about and adopt risk management strategies. Don’t get greedy. Stay #SAFU.",,,,1621905301,,,,Tweet,1396998202826518528,
,['https:\\/\\/t.co\\/wKbjqAi7rB'],CZ  Binance,Hope you all had a chance to get #bnb at the $200 range. You had 2 chances. Not financial advice.,,,,1621904324,,,,Tweet,1396994104463028224,
,,CZ  Binance,I was originally gonna tweet:We are apes.,,,,1621869983,,,,Tweet,1396850069664534528,
,['https:\\/\\/t.co\\/yOBIcItg9l'],CZ  Binance,Welcome to #crypto. » Hedge Fund Billionaire Ray Dalio: ‘I Have Some Bitcoin’ - CoinDesk,,,,1621863952,,,,Tweet,1396824775108874240,
,,CZ  Binance,Ape mode.,,,,1621860585,,,,Tweet,1396810653386481664,
,,CZ  Binance,,,,,1621860542,,,,Tweet,1396810471408168960,
,,CZ  Binance,People who panic sold are more likely to FOMO back in.,,,,1621847415,,,,Tweet,1396755412548947968,
,['https:\\/\\/t.co\\/pvfo3aRQyD'],CZ  Binance,» 11 Features of Binance Mobile App That Will Make Your Life and Trade Easier | Binance Blog,,,,1621839271,,,,Tweet,1396721254690746368,
,['https:\\/\\/t.co\\/L94VXMJJce'],CZ  Binance,We are hiring.,,,,1621827525,,,,Tweet,1396671989197074432,
,['https:\\/\\/t.co\\/DzUp5TbnB0'],CZ  Binance,#buidl  » Dynamo Kiev to Sell NFT Soccer Tickets on Upcoming Binance Marketplace - Decrypt,,,,1621825666,,,,Tweet,1396664190761275392,
,,CZ  Binance,Markets tend to over swing in both directions.,,,,1621823338,,,,Tweet,1396654425482006528,
,,CZ  Binance,Tweeted this when the markets where going up like crazy. Equally applicable now.,,,,1621822737,,,,Tweet,1396651905422479360,
,,CZ  Binance,"The key is to look at the high/low price row in the image above. If you know, you know.",,,,1621786041,,,,Tweet,1396497990735437824,
,,CZ  Binance,"Disclaimer: I haven't sold a single crypto in the last few days/months, and no plans to do so in the future either.I don't ""sell"" crypto. I do use #crypto to buy things, from groceries to companies, except fiat.Not financial advice.",,,,1621785744,,,,Tweet,1396496745803091968,
,,CZ  Binance,"It's not the first time, and won't be the last time. #bitcoin",,,,1621784861,,,,Tweet,1396493041611919360,
,,CZ  Binance,Chart taken from @CoinMarketCap.,,,,1621775641,,,,Tweet,1396454372712751104,
,,CZ  Binance,"Same chart as my last tweet, #bitcoin price. The best performing assets over the last 12 years. Yet, when I tried to color code the market sentiment on it, this is what it looks like. Green = happy, red = unhappy.Our species is hard to satisfy.",,,,1621775549,,,,Tweet,1396453986106953728,
,,CZ  Binance,"Unpopular opinion: #bitcoin is such a bad store of value. It keeps going up, with some fluctuations at times.Not financial advice.",,,,1621774311,,,,Tweet,1396448791570513920,
,,CZ  Binance,"I can't predict the future, I just know #bitcoin will be part of it.nfa.",,,,1621739339,,,,Tweet,1396302109096644608,
,,CZ  Binance,"We sent 2 tanks like this, should help save about 12,000 lives. Stay strong #India.",,,,1621736785,,,,Tweet,1396291398463213568,
,,CZ  Binance,"Had a typo, originally, I was going to say, if you can’t hold, I got no...  But the typo tweet may work better.",,,,1621705167,,,,Tweet,1396158779910066176,
,,CZ  Binance,I want to work in DeFi...,,,,1621705029,,,,Tweet,1396158202668994560,
,,CZ  Binance,I have been through a few cycles from 2013. If you can hodl... I got no financial advice for you.,,,,1621704800,,,,Tweet,1396157243297472512,
,,CZ  Binance,"Got my x-ray back. Yup, confirmed.#BNB",,,,1621601235,,,,Tweet,1395722859545186304,
,,CZ  Binance,Good dog.,,,,1621533733,,,,Tweet,1395439735217164288,
,,CZ  Binance,"If the market don't shake out the weak hands, it won't have the strong foundation to grow further. With weak hands in there, at some point, it must have a retrace. Not sure which one causes which. But after a shake out, the foundation is stronger.",,,,1621533565,,,,Tweet,1395439031492644864,
,,CZ  Binance,Forgot to add. Not financial advice.,,,,1621527023,,,,Tweet,1395411593064714240,
,,CZ  Binance,"Slap yourself, if you sold #BTC under $100,000.",,,,1621526993,,,,Tweet,1395411464266031104,
,,CZ  Binance,"Just like the previous tweet, some will make fun of this tweet for a while. Let them have at it. Eventually, time will show.",,,,1621526993,,,,Tweet,1395411466522558464,
,,CZ  Binance,This is made into a song?,,,,1621526752,,,,Tweet,1395410454248189952,
,['https:\\/\\/t.co\\/vrzdztAH6O'],CZ  Binance,Live panel just now. » Crypto's Mainstream Moment | How Crypto is Driving Fiat Innovation - YouTube,,,,1621525997,,,,Tweet,1395407289721397248,
,,CZ  Binance,"For most people, I strongly recommend a HODL strategy rather than an active trading strategy to try to catch the elusive opportunities like below.Not financial advice.",,,,1621522858,,,,Tweet,1395394120772820992,
,['https:\\/\\/t.co\\/liJ2hDDhFl'],CZ  Binance,"There are chaos, and opportunities. The last 14 hours or so. nfa.",,,,1621522684,,,,Tweet,1395393393497309184,
,,CZ  Binance,Prices actually went much further down than the screen shot taken just now. But the screen shot will do.,,,,1621458793,,,,Tweet,1395125412649312256,
,,CZ  Binance,"If you aren’t sure, you deserved to be shaken out. Will leave this tweet here for future reference. Today(bloody day)’s prices:",,,,1621458669,,,,Tweet,1395124893490946048,
,,CZ  Binance,Unpopular opinion: #buidl.,,,,1621450925,,,,Tweet,1395092412125433856,
,,CZ  Binance,I wonder what technical analysts say about this chart on #BNB usage. NFA.,,,,1621440899,,,,Tweet,1395050362344640512,
,,CZ  Binance,"If you panic sell, you won't be crypto rich.NFA.",,,,1621440133,,,,Tweet,1395047147725152256,
,,CZ  Binance,It is very simple once it is explained like that. #BSC has the highest number of users of all #DeFi networks.,,,,1621439709,,,,Tweet,1395045369872982016,
,,CZ  Binance,Strong hands shaking out weak hands.Just my opinion. nfa.,,,,1621438389,,,,Tweet,1395039834184437760,
,,CZ  Binance,"If I told you a year ago that #BNB price would crash to $430 today, what would you do?#BNB price a year ago",,,,1621412958,,,,Tweet,1394933169191747584,
,,CZ  Binance,"I would love to tell you guys to over trade, it would be good for commissions.But I have to tell you: For most of you, HODL is a much better strategy in the long run. Don't over trade.nfa.",,,,1621405658,,,,Tweet,1394902549711392768,
,,CZ  Binance,"Bought 2 cases of Maotai using #BNB, not #Binance Card, but paid in BNB directly. I was going to buy one case, the seller says he wants more BNB and asked me to buy a 2nd case. I am an easy customer. I am not really a Maotai drinker. But love the #BNB adoption.",,,,1621403967,,,,Tweet,1394895458682605568,
,,CZ  Binance,#HODLNot financial advice.,,,,1621403457,,,,Tweet,1394893317293305856,
,,CZ  Binance,"I liked some tweet of projects on #BSC, it turned out to be a scam project. Unliked it. My likes are random and not endorsements.",,,,1621341358,,,,Tweet,1394632857671266304,
,,CZ  Binance,Another oxygen tank leaving from Singapore port to India. I am told each one can help save about 6000 lives.More on the way. Made possible by #BNB and your support. Proud to be a Binancian. @BinanceBCF #BNB,,,,1621313810,,,,Tweet,1394517312380702720,
,,CZ  Binance,Who is kinda like this driver in crypto?,,,,1621259520,,,,Tweet,1394289604187017216,
,,CZ  Binance,Everything is so dramatic. #BUIDL is suppose to be somewhat boring.,,,,1621235461,,,,Tweet,1394188692072239104,
,,CZ  Binance,This tweet is only 2 hours old. NFA.,,,,1621235384,,,,Tweet,1394188368074862592,
,,CZ  Binance,"Man, this industry has a lot of room to grow.",,,,1621233611,,,,Tweet,1394180932215599104,
,,CZ  Binance,"#Bitcoin/#crypto have not changed. They don't care. There are always fluctuations in the market, for all kind of reasons. You can blame others for what they tweet (their freedom). Or you can take advantage of the opportunities.Not financial advice.",,,,1621226681,,,,Tweet,1394151865256792064,
,,CZ  Binance,Never a boring day in crypto. Always exciting.Never a normal day in crypto. Always weird.,,,,1621190371,,,,Tweet,1393999571315924992,
,,CZ  Binance,"Between a $1 trillion dollar idea and a $1 dollar execution ability, I always choose the later. And prefer to receive it in #BNB. NFA.",,,,1621180045,,,,Tweet,1393956259628392448,
