re_tweeter,links,author,text,hashtags,reply_count,associated_tweet,timestamp,mentions,author_id,retweet_count,type,id,favorite_count
,,CZ  Binance,"I love most tihings in the world, but I hate jet lags.",,,,1654195218,,,,Tweet,1532431931656261632,
,,CZ  Binance,#MalaysiaBoleh,,,,1654181362,,,,Tweet,1532373816135008256,
,,CZ  Binance,Just finished a live interview with CNBC Squawk Box. This was my “studio”. Haha.,,,,1654167185,,,,Tweet,1532314352384151552,
,['https:\\/\\/t.co\\/uh837JZjok'],CZ  Binance,"I'll be speaking at the Point Zero Forum in Zurich, Switzerland later this month, to discuss decentralized finance and web 3, embedded finance and sustainable finance.",,,,1654163469,,,,Tweet,1532298767310929920,
,,CZ  Binance,Humbled to receive this #cryptowarrior gift from our Malaysia partners.,,,,1654153218,,,,Tweet,1532255772624580608,
,,CZ  Binance,Here is a tweet for you to comment on.,,,,1654153114,,,,Tweet,1532255337121599488,
,,CZ  Binance,,,,,1654153034,,,,Tweet,1532255000025391104,
,['https:\\/\\/t.co\\/GEJFCUmpLL'],CZ  Binance,Continue to invest in the industry.,,,,1654152157,,,,Tweet,1532251319880208384,
,,CZ  Binance,#CZINMY,,,,1654141333,,,,Tweet,1532205922004742144,
,,CZ  Binance,"Adoption takes time, but can’t be stopped.(Siri’s answer)",,,,1654077886,,,,Tweet,1531939804723695616,
,,CZ  Binance,,,,,1654076540,,,,Tweet,1531934160088182784,
,,CZ  Binance,"From the author whose name was the first programming language I learnt, Pascal.",,,,1654029456,,,,Tweet,1531736674639699968,
,,CZ  Binance,l'homme est un roseau pensant.,,,,1654029394,,,,Tweet,1531736415654006784,
,['https:\\/\\/t.co\\/4FRifNsiWh'],CZ  Binance,"The the going gets tough, the builders shine even brighter.",,,,1654010769,,,,Tweet,1531658297471864832,
,['https:\\/\\/t.co\\/eJHxiA9Wwu'],CZ  Binance,"29 shopping malls, 13 hotels and four mixed-use communities, now accepts #crypto through #Binance Pay.Adoption continues. #BNB",,,,1653992694,,,,Tweet,1531582484554600448,
,['https:\\/\\/t.co\\/WWaQ57WkTK'],CZ  Binance,"Crypto and Money Laundering: An Inconvenient Truth. Spoiler: the overwhelming majority of all money laundered goes through the traditional banking system, not crypto.",,,,1653979710,,,,Tweet,1531528027557052416,
,,CZ  Binance,Avoid them like a plague.,,,,1653921588,,,,Tweet,1531284244663787520,
,,CZ  Binance,"In bear markets, it is actually easier to spot the weak projects, and founders who are money driven instead of mission driven.",,,,1653920945,,,,Tweet,1531281549940883456,
,,CZ  Binance,When they track you to the hour...,,,,1653902121,,,,Tweet,1531202595699757056,
,['https:\\/\\/t.co\\/dJ2xyWUejT'],CZ  Binance,"41 Staff in El Salvador, and growing. Long term commitment to solving problems.",,,,1653901973,,,,Tweet,1531201971532832768,
,,CZ  Binance,3 years ago in Istanbul,,,,1653820478,,,,Tweet,1530860158405976064,
,,CZ  Binance,More info here.,,,,1653751890,,,,Tweet,1530572478942269440,
,,CZ  Binance,"The team is working flat out to distribute the $LUNA airdrop to #Binance  users. We have a big user base, so please bear with us as we process the airdrop. Need a bit of time to execute. Thanks",,,,1653751877,,,,Tweet,1530572426152759296,
,,CZ  Binance,Credibility is the ultimate currency.,,,,1653747978,,,,Tweet,1530556070988480512,
,['https:\\/\\/t.co\\/pNh2VzfcnP'],CZ  Binance,Binance ottiene la registrazione in Italia,,,,1653742275,,,,Tweet,1530532150075867136,
,,CZ  Binance,Blockchain is a new technology for money. Not developing a local crypto industry today will have devastating effects on the future of the local economy.,,,,1653734084,,,,Tweet,1530497797086187520,
,,CZ  Binance,"Playing table tennis with Minister of Digital, Bagdat Mussin, in Kazakhstan, in a suit.Before this time, also played with a minister in Dubai once.I lost both times.  Better keep my job.",,,,1653725372,,,,Tweet,1530461254879531008,
,,CZ  Binance,,,,,1653676412,,,,Tweet,1530255900807639040,
,['https:\\/\\/t.co\\/pZGSI3CdaU'],CZ  Binance,Action speaks louder than words.,,,,1653674004,,,,Tweet,1530245802936963072,
,['https:\\/\\/t.co\\/sXCm7qieJq'],CZ  Binance,#Binance granted regulatory approval in Italy,,,,1653668912,,,,Tweet,1530224444353957888,
,['https:\\/\\/t.co\\/1a7Nfc3LsU'],CZ  Binance,Breaking: #Binance registered in Italy!,,,,1653665836,,,,Tweet,1530211543622762496,
,,CZ  Binance,"JA Hotels, one of the oldest chains in UAE with hotels in Dubai, Maldives, Seychelles, etc just signed up with #Binance Pay.Pushing adoption.",,,,1653665616,,,,Tweet,1530210620355796992,
,['https:\\/\\/t.co\\/ZiAaOaP1lD'],CZ  Binance,Credit to @2breeze3.,,,,1653651922,,,,Tweet,1530153184022380544,
,,CZ  Binance,does it look like me? #BinancePizza,,,,1653651883,,,,Tweet,1530153018095767552,
,,CZ  Binance,Success does not come from how many things you do. It comes from how well you do on a few very selected things. Focus.,,,,1653646908,,,,Tweet,1530132153127866368,
,,CZ  Binance,No one controls the #bitcoin network.,,,,1653608083,,,,Tweet,1529969308293554176,
,,CZ  Binance,Do the right things. Then no stress.,,,,1653580987,,,,Tweet,1529855661642743808,
,['https:\\/\\/t.co\\/TXr0EKJW7x'],CZ  Binance,Do you know what is Category 4?#Bahrain #Binance,,,,1653571765,,,,Tweet,1529816981796335616,
,,CZ  Binance,This was a gift.,,,,1653559535,,,,Tweet,1529765682929336320,
,['https:\\/\\/t.co\\/V0reJAdaNX'],CZ  Binance,When in Kazakhstan,,,,1653559235,,,,Tweet,1529764426668199936,
,['https:\\/\\/t.co\\/eh4YDZjbi9'],CZ  Binance,Crypto ⇄ Music,,,,1653507270,,,,Tweet,1529546470080270336,
,,CZ  Binance,"Pushing adoption, never stop.",,,,1653481772,,,,Tweet,1529439520843866112,
,['https:\\/\\/t.co\\/K4MsXM646M'],CZ  Binance,President of the Republic of Kazakhstan Kassym-Jomart Tokayev meets CEO of Binance Changpeng Zhao,,,,1653481752,,,,Tweet,1529439439285534720,
,,CZ  Binance,Build,,,,1653421184,,,,Tweet,1529185398840123392,
,,CZ  Binance,#bnb,,,,1653418598,,,,Tweet,1529174550310572032,
,,CZ  Binance,,,,,1653385469,,,,Tweet,1529035599994404864,
,,CZ  Binance,"2 years ago, #BNB price was $16.",,,,1653384647,,,,Tweet,1529032149638209536,
,['https:\\/\\/t.co\\/9bi0nH5Qtq'],CZ  Binance,"Growth is exponential. 1% is about the halfway mark. Crossing the chasm soon.""In 2021, 12% of adults held or used crypto, mostly as investments. 3% said that they used crypto to buy something or make a payment, or send money to friends or family.""",,,,1653383209,,,,Tweet,1529026119881707520,
,,CZ  Binance,HODL = Hold on for dear life.I only learned this only 3 days ago. Learn something new everyday.,,,,1653328324,,,,Tweet,1528795913510129664,
,['https:\\/\\/t.co\\/Ab87W4FEIG'],CZ  Binance,"Users before shareholders.If you have a problem with the above, bye.",,,,1653327956,,,,Tweet,1528794370442420224,
,,CZ  Binance,"Quickly, or slowly, just don't stop.",,,,1653327678,,,,Tweet,1528793206057484288,
,,CZ  Binance,"Alright, time to upgrade something I said before.",,,,1653327645,,,,Tweet,1528793066278211584,
,,CZ  Binance,"If someone send you a picture of them and me, and claim they know me well. Treat them as scammers.My real friends don't do that. They don't need to.",,,,1653323742,,,,Tweet,1528776697885097984,
,['https:\\/\\/t.co\\/qJeJUpCXc3'],CZ  Binance,Welcome to Dubai!Dubai Grants Ex-Singapore Parliamentarian Calvin Cheng's Web3 Company a Virtual Asset License,,,,1653303393,,,,Tweet,1528691346277404672,
,,CZ  Binance,Did I hear free pizza?,,,,1653221962,,,,Tweet,1528349802433376256,
,,CZ  Binance,It’s a blessing to be busy on Sunday.,,,,1653214777,,,,Tweet,1528319662819262464,
,,CZ  Binance,"I casually said in our leadership chat ""it's just money, lol...""",,,,1653212432,,,,Tweet,1528309828703113216,
,['https:\\/\\/t.co\\/MfhhEHQTET'],CZ  Binance,"""You will see signs that tell you that you are working in an extraordinary company. It will usually be in decisions made when things were hard. That said I have never worked anywhere where we made them this quickly.""",,,,1653207976,,,,Tweet,1528291138020548608,
,,CZ  Binance,Let's increase financial inclusion with #crypto.Data source: The Global Findex,,,,1653206292,,,,Tweet,1528284077140361216,
,,CZ  Binance,"Saw an article about insider trading. We have a zero-tolerance policy and hold ourselves to the highest standards. 3 investigators reviewed the wallets, none is associated with Binance employees.If you see anything suspicious email audit@binance.com1/2",,,,1653150667,,,,Tweet,1528050767390572544,
,,CZ  Binance,"This is why we even try not to let project teams know when they will be listed. But sometimes it can’t be completely avoided when we require technical assistance in wallet integration, etc.Please use the above whistleblower email when you notice suspicious activity.",,,,1653150667,,,,Tweet,1528050769282314240,
,,CZ  Binance,Thanks for all your questions. Answered as many as I could. Seems @reddit has taken the AMA thread down. Working to get it back so you can see my answers.,,,,1653147873,,,,Tweet,1528039048736022528,
,['https:\\/\\/t.co\\/gIcMstB6qf'],CZ  Binance,Reddit AMA starting soon. Ask your questions there.,,,,1653138979,,,,Tweet,1528001745372209152,
,,CZ  Binance,Please help to upvote good questions. And downvote any blatant spam.,,,,1653121950,,,,Tweet,1527930319927746560,
,['https:\\/\\/t.co\\/rbaX2HyUWB'],CZ  Binance,Doing an AMA on reddit later.,,,,1653121679,,,,Tweet,1527929181828485120,
,,CZ  Binance,"Thanks to Mister Pizza for letting us use the shop, and teaching me how to make the pizza.",,,,1653083120,,,,Tweet,1527767453090123776,
,,CZ  Binance,Happy #BitcoinPizzaDay!,,,,1653083005,,,,Tweet,1527766974025048064,
,['https:\\/\\/t.co\\/9SPSrQNdme'],CZ  Binance,,,,,1653075695,,,,Tweet,1527736310731100160,
,,CZ  Binance,New job  #BinancePizza,,,,1653075494,,,,Tweet,1527735468372131840,
,,CZ  Binance,"With @CharlieShrem, talked to him 9 years ago, finally met in person. Welcome to crypto.",,,,1652992372,,,,Tweet,1527386832152895488,
,,CZ  Binance,Je suis à Cannes avec @davidlisnard. Merci pour le vin,,,,1652978937,,,,Tweet,1527330478918754304,
,['https:\\/\\/t.co\\/NA2GAz33fZ'],CZ  Binance,#BNB Chain offers another lifeline to Terra ecosystem projects,,,,1652976287,,,,Tweet,1527319365162770432,
,,CZ  Binance,"If you experience withdrawal slow downs, check the blockchain.",,,,1652941230,,,,Tweet,1527172325711523840,
,,CZ  Binance,"Maverick is a great movie. I must admit, watching the movie with the cast beside you is a pretty cool experience.",,,,1652915322,,,,Tweet,1527063661113638912,
,,CZ  Binance,My idol @TomCruise at #CannesFilmFestival2022,,,,1652915063,,,,Tweet,1527062572440100864,
,,CZ  Binance,First time in a tux in my life. Going to see a movie.Let’s bring movies to web3.,,,,1652891120,,,,Tweet,1526962147745579008,
,,CZ  Binance,Nice is nice.,,,,1652880702,,,,Tweet,1526918452010786816,
,,CZ  Binance,"#Dubai Museum of the Future is impressive, definitely worth a visit if you haven’t. I done it twice already. And I usually don’t do these things.",,,,1652873050,,,,Tweet,1526886357410398208,
,['https:\\/\\/t.co\\/LjhacEl0C8'],CZ  Binance,"Dubai’s Museum of the Future, Binance NFT launch their first-ever NFT collection",,,,1652872021,,,,Tweet,1526882041110872064,
,,CZ  Binance,The good old days.,,,,1652871538,,,,Tweet,1526880016277053440,
,,CZ  Binance,This whole place was packed. First with this many people in the audience for me.,,,,1652870811,,,,Tweet,1526876967794053120,
,,CZ  Binance,They asked me if I want to put some make up on before I go on stage…I said no.,,,,1652865161,,,,Tweet,1526853268030205952,
,['https:\\/\\/t.co\\/KFSUt9gN9L'],CZ  Binance,Going live.,,,,1652862781,,,,Tweet,1526843287730257920,
,,CZ  Binance,In a few hours.,,,,1652858569,,,,Tweet,1526825622001131520,
,,CZ  Binance,"Meeting the #Binance Angels in Germany yesterday.Binance Angels are community volunteers, not paid. They are mission driven.",,,,1652856234,,,,Tweet,1526815824551587840,
,,CZ  Binance,"Welcome to #BNB chain! In these rough times, the #BNB community is ready to welcome any project needing assistance.",,,,1652817424,,,,Tweet,1526653045886574592,
,,CZ  Binance,Focus on helping projects build. Grow crypto together.,,,,1652797810,,,,Tweet,1526570778698948608,
,,CZ  Binance,"We are hiring, aggressively. Find where to apply yourself. It’s the first test/filter.",,,,1652796910,,,,Tweet,1526567001866522624,
,,CZ  Binance,"This is what diamond hands look like, the coins were never moved off the receiving address.This is a non-trader hold strategy. If you adopt this strategy, you should also have some diversification. NFA.",,,,1652760507,,,,Tweet,1526414316261584896,
,['https:\\/\\/t.co\\/Sm8SSNz0q1'],CZ  Binance,"""Lots of people reassured by the fact that unlike in traditional finance, even 'big players' like CZ can end up being 'bag holders' in the crypto industry."" Lesson: manage your risks. We can handle ours.",,,,1652759943,,,,Tweet,1526411953521971200,
,['https:\\/\\/t.co\\/88v2U2vjfM'],CZ  Binance,Poor again.,,,,1652759680,,,,Tweet,1526410849954541568,
,['https:\\/\\/t.co\\/6Cv6TWO2vj'],CZ  Binance,"Taking a break, different topic. Is this tech real? We should use blockchain to fund these types of research and manufacturing, right?",,,,1652727717,,,,Tweet,1526276786040053760,
,,CZ  Binance,SMH,,,,1652727491,,,,Tweet,1526275839339421696,
,,CZ  Binance,5/5 Protect users.,,,,1652692683,,,,Tweet,1526129843653550080,
,['https:\\/\\/t.co\\/QnMx8aZ09A'],CZ  Binance,"4/ Now the important part.To lead by example on PROTECTING USERS, Binance will let this go and ask the Terra project team to compensate the retails users first, Binance last, if ever. Binance (after a 5 min discussion) fully support this proposal.",,,,1652692682,,,,Tweet,1526129841376043008,
,,CZ  Binance,"3/ On this same address, we have about $12,000,000 UST from staking over time (not bought). Also never moved or sold.",,,,1652692682,,,,Tweet,1526129839509487616,
,,CZ  Binance,"1/5. Some interesting updates, full transparency and lead to protect users:As it turns out, most UST pairs were 0 fee to begin with. (I didn't know that, our team had to tell me.) So, not much UST there.We do have...",,,,1652692681,,,,Tweet,1526129834958770176,
,['https:\\/\\/t.co\\/6HwTu6CCuB'],CZ  Binance,"2/ Binance received 15,000,000 LUNA (at peak worth $1.6 billion USD, now not much) as part of the original ($3m) invest. 560x return at peak. It still sits on the address we received at . Never moved or sold. Address:",,,,1652692681,,,,Tweet,1526129837299093504,
,,CZ  Binance,Adoption.,,,,1652689187,,,,Tweet,1526115181444714496,
,,CZ  Binance,@FrancescoBerti_,,,,1652682799,,,,Tweet,1526088385126969344,
,['https:\\/\\/t.co\\/YV3xKCalyC'],CZ  Binance,Was an honor chatting with MP Francesco B and others in Italy  last week. Many thanks for the written summary!,,,,1652682369,,,,Tweet,1526086584512167936,
,,CZ  Binance,"I did ask about the rumored ""2nd round investments or UST"". There were discussions, never closed.Binance did not buy UST.",,,,1652641837,,,,Tweet,1525916578818162688,
,,CZ  Binance,"Reading some comments on Twitter, it just occurred to me that I haven't asked our team if @Binance had any UST. (I don't have access to our admin backend, for security reasons. I always have to ask someone to get info.) I just asked now. 1/2",,,,1652641617,,,,Tweet,1525915656599789568,
,,CZ  Binance,"We probably do have some from trading fees. Probably valued close to 0 now. (Think of it as free trading in the past, haha). This just wasn't on my mind. Not how we prioritize things. Users first.",,,,1652641617,,,,Tweet,1525915658596368384,
,,CZ  Binance,"6/ In this regard, I would like to see more transparency from them. Much more! Including specific on-chain transactions (txids) of all the funds. Relying on 3rd party analysis is not sufficient or accurate. This is the first thing that should have happened.",,,,1652603261,,,,Tweet,1525754779049377792,
,,CZ  Binance,"7/ I am not always right, but my perspective is: Failures can/will happen. But when they do, transparency, speedy communication and owning responsibility to the community is extremely important.",,,,1652603261,,,,Tweet,1525754780877987840,
,,CZ  Binance,"8/ I am just hoping that the project teams can rise from the ashes and rebuild in a proper and sensible way. Regardless of my personal views, or the solution chosen in the end, we will always be here to support the community in any way we can.",,,,1652603261,,,,Tweet,1525754782664822784,
,,CZ  Binance,"5/ The last few days, we tried hard to support the Terra community. In my tweets, I am simply pointing out the potential issues from my understanding. Minting, forking, don’t create value. Buying back, burning does, but requires funds. Funds that the project team may not have.",,,,1652603260,,,,Tweet,1525754777170231296,
,,CZ  Binance,"4/ Binance Labs invested in hundreds of projects over the last 4 years, including exchange “competitors” and many “competing” blockchains. A few of them have fallen by the wayside, but a few have been extremely successful. That’s how investments work.",,,,1652603260,,,,Tweet,1525754775333179392,
,,CZ  Binance,"1/8 These past weeks have proven to be a watershed moment for the crypto industry. We have witnessed the rapid decline of a major project, which sent ripples across the industry, but also a new found resiliency in the market that did not exist during the last market downswing.",,,,1652603259,,,,Tweet,1525754770165837824,
,,CZ  Binance,3/ Binance did not participate in the 2nd round of Luna’s fund raising nor did we acquire any UST. Binance Labs invested $3m USD in Terra (the layer 0 blockchain) in 2018. UST came much later after our initial investment.,,,,1652603259,,,,Tweet,1525754773626097664,
,,CZ  Binance,"2/ First, I need to address falsehoods circulating in crypto twitter.",,,,1652603259,,,,Tweet,1525754772040601600,
,,CZ  Binance,"I don't hold UST, never had. And I don't know it too well. Usually busy with other things, but now dragged into this.",,,,1652530607,,,,Tweet,1525450048913416192,
,,CZ  Binance,Shouldn't those BTC be ALL used to buy back UST first?,,,,1652530478,,,,Tweet,1525449504631177216,
,,CZ  Binance,"Personal opinion. NFA. This won't work.- forking does not give the new fork any value. That's wishful thinking.- one cannot void all transactions after an old snapshot, both on-chain and off-chain (exchanges).Where is all the BTC that was supposed to be used as reserves?",,,,1652530302,,,,Tweet,1525448766274289664,
,['https:\\/\\/t.co\\/XEFMffTjtX'],CZ  Binance,Learn a little bit every day.Dead Cat Bounce | Binance Academy,,,,1652527687,,,,Tweet,1525437799981260800,
,,CZ  Binance,"The design flaw: minting coins (printing money) does not create value, it just dilutes the existing coin holders. Incentives doesn’t create value. It is just a bootstrap mechanism. Build products people use.",,,,1652476495,,,,Tweet,1525223086638899200,
,['https:\\/\\/t.co\\/hBn57GAR59'],CZ  Binance,6 million reasons to thank you for all your support. 120 million reasons the fight for the safety of our users.,,,,1652473912,,,,Tweet,1525212249878630400,
,,CZ  Binance,You can't mint your way out of bankruptcy all the time.,,,,1652457558,,,,Tweet,1525143657724235776,
,,CZ  Binance,"Many people don't get this point. If we didn't push the issue, the Terra blockchain may still be in ""halted"" mode, or worse with super minting...",,,,1652457429,,,,Tweet,1525143116679979008,
,,CZ  Binance,"Was in a no-phone meeting for 2hrs. At least, there is progress.Luna blockchain resumed, no more minting.And deposits, withdrawals and trading resumed. Trading is important for existing holders.Please do NOT buy a coin just because trading is on. DYOR! EXTREME caution!",,,,1652457020,,,,Tweet,1525141401176051712,
,,CZ  Binance,₿N₿,,,,1652444397,,,,Tweet,1525088457143504896,
,,CZ  Binance,"7. We know there are different opinions in the community, we felt suspending trading is the best way to protect our users at this time. We will continue to monitor the situation closely 24/7. All actions will be announced on @binance.  - CZ",,,,1652437799,,,,Tweet,1525060781305475072,
,,CZ  Binance,"6. (This is in sharp contrast to Axie Infinity, where the team took accountability, had a plan, and were communicating with us proactively. And we helped.)",,,,1652437798,,,,Tweet,1525060779979988992,
,,CZ  Binance,"4. While #Binance always aims to be neutral, helpful and protective of all users and industry peers, and we typically refrain from commenting on other projects, I will break that rule this time.",,,,1652437797,,,,Tweet,1525060773952819200,
,,CZ  Binance,"5. I am very disappointed with how this UST/LUNA incident was handled (or not handled) by the Terra team. We requested their team to restore the network, burn the extra minted LUNA, and recover the UST peg. So far, we have not gotten any positive response, or much response at all",,,,1652437797,,,,Tweet,1525060775391510528,
,,CZ  Binance,"3. Some of our users, unaware of the large amounts of newly minted LUNA outside the exchange, started to buy LUNA again, without understanding that as soon as deposits are allowed, the price will likely crash further. Due to these significant risks, we suspended trading.",,,,1652437797,,,,Tweet,1525060772543578112,
,,CZ  Binance,1. At #Binance we prioritize user protection. We made the decision to suspend LUNA and UST trading. Here's why.  A thread,,,,1652437796,,,,Tweet,1525060769771048960,
,,CZ  Binance,"2. An exponential amount of new LUNA were minted due to flaws in the design of the Terra protocol. Their validators have suspended their entire network, resulting in no deposits or withdrawals possible to or from any exchange.",,,,1652437796,,,,Tweet,1525060771205505024,
,,CZ  Binance,"Was fun visiting the training center of Lazio. Pepe Reina’s hand shake is like a robot arm, nothing will get through those hands.",,,,1652368990,,,,Tweet,1524772178431983616,
,,CZ  Binance,We are still here.,,,,1652347930,,,,Tweet,1524683844225576960,
,,CZ  Binance,"For every seller, there is a buyer.",,,,1652314569,,,,Tweet,1524543919001907200,
,,CZ  Binance,"If you think crypto is volatile, look at stocks. -84%, -72%.Not that it makes the situation any better in crypto, but... zoom out. Learn about risk management.",,,,1652314131,,,,Tweet,1524542080969805824,
,,CZ  Binance,"At the end of the day, we need to go back to fundamentals. Build real products, not reliant on short term incentives, or promotions, but with intrinsic value that people use.",,,,1652313375,,,,Tweet,1524538909241360384,
,,CZ  Binance,"More than anything else, we need to humbly respect the market, and not be cocky. Build step by step, day after day. And leave the rest to market and time.Stay #SAFU.",,,,1652313375,,,,Tweet,1524538910646456320,
,,CZ  Binance,"We are in a new market, with many innovations. Algo stable coins is one of them. When they are hot, they are all the rage. When they drop, it can be a vicious circle. Some innovations will become successful, many won’t.",,,,1652313374,,,,Tweet,1524538907790123008,
,,CZ  Binance,"Many asked me about the markets today. We need to respect the market, with a level of caution too. It goes up and down in cycles. And especially the fact that it doesn’t always make sense. 1/4",,,,1652313374,,,,Tweet,1524538906234007552,
,['https:\\/\\/t.co\\/AqswFY3xm3'],CZ  Binance,The Importance of Fiat Reserve-Backed Stablecoins,,,,1652291923,,,,Tweet,1524448933266739200,
,,CZ  Binance,"High system and blockchain load today. Binance P2P trading had a server issue, and is in maintenance mode. Our team is on it. Should recover in 30-60 min. All other systems (spot & futures) are fine.",,,,1652279302,,,,Tweet,1524395997031538688,
,,CZ  Binance,"Some blockchain congestion and node syncing issues with ETH (also high fees) and LUNA, deposit and withdrawals may take longer than usual to process. Other networks all working fine. Our teams are monitoring closely. Funds are #SAFU.",,,,1652279030,,,,Tweet,1524394857556496384,
,['https:\\/\\/t.co\\/98S3VfNgga'],CZ  Binance,"Forbes incontra Changpeng Zao, il fondatore dell'exchange di criptovalue Binance",,,,1652273113,,,,Tweet,1524370040480571392,
,,CZ  Binance,Positive side: Crypto will stay.,,,,1652262297,,,,Tweet,1524324674175475712,
,,CZ  Binance,"One over leveraged ""stable"" coin...",,,,1652262254,,,,Tweet,1524324491811332096,
,,CZ  Binance,Previous wrong post - by the big intern CZ,,,,1652261996,,,,Tweet,1524323412587470848,
,['https:\\/\\/t.co\\/qzsbleEZeB'],CZ  Binance,» Il re di Binance cerca spazio in Italia: «Le crypto rivoluzionano il denaro» - Il Sole 24 ORE,,,,1652261924,,,,Tweet,1524323108211073024,
,['https:\\/\\/t.co\\/SbIpagIGoX'],CZ  Binance,» Il re di Binance cerca spazio in Italia: «Le crypto rivoluzionano il denaro» - Il Sole 24 ORE,,,,1652260785,,,,Tweet,1524318330408030208,
,['https:\\/\\/t.co\\/pq9dbCbvyT'],CZ  Binance,Many countries want web3.,,,,1652247848,,,,Tweet,1524264072077840384,
,,CZ  Binance,Enlightenment,,,,1652222623,,,,Tweet,1524158268930727936,
,,CZ  Binance,"A bit packed, high energy though. #Binance meet up",,,,1652221840,,,,Tweet,1524154986803998720,
,,CZ  Binance,Binancians in Italy are early birds. See you at the event soon.,,,,1652196212,,,,Tweet,1524047491800473600,
,['https:\\/\\/t.co\\/fz1ylu56E6'],CZ  Binance,Buongiorno,,,,1652181772,,,,Tweet,1523986927996706816,
,,CZ  Binance,,,,,1652181627,,,,Tweet,1523986320275607552,
,,CZ  Binance,"Emotions. If you panic during a dip, you probably over invested. Try reduce your investment size by 2x or 10x. You will be in a much better position to control your emotions. Only increase your position when you can handle your emotions.",,,,1652163040,,,,Tweet,1523908360948654080,
,,CZ  Binance,"It might be the first time and painful for you, but it's not the first time for #bitcoin. It just looks flat now. This (now) will look flat in a few years too.",,,,1652162639,,,,Tweet,1523906676755161088,
