re_tweeter,links,author,text,hashtags,reply_count,associated_tweet,timestamp,mentions,author_id,retweet_count,type,id,favorite_count
,['https:\\/\\/t.co\\/7zLNPg0KRp'],CZ  Binance,» Binance Smart Chain on-chain activity explodes ahead of Bruno upgrade on November 30,,,,1637685273,,,,Tweet,1463184202325639168,
,,CZ  Binance,Live video interview with Yahoo! Finance in 15 min (scheduled a few days ago). Wonder what they will ask me...,,,,1637676944,,,,Tweet,1463149269213343744,
,,CZ  Binance,We are all in one team. Just some in-team chats...,,,,1637676017,,,,Tweet,1463145380774772736,
,,CZ  Binance,This is a fairly accurate description of what happened with #doge. We are transparent (not shady). Thank you!,,,,1637666972,,,,Tweet,1463107445731905536,
,,CZ  Binance,Don’t try to predict the future; Don’t fight it either; Just go along with it.,,,,1637643630,,,,Tweet,1463009540639649792,
,,CZ  Binance,I need a body that sleeps less.,,,,1637601797,,,,Tweet,1462834081968783360,
,,CZ  Binance,#Binance @BinanceFanToken,,,,1637597120,,,,Tweet,1462814464215027712,
,,CZ  Binance,What to list?,,,,1637565900,,,,Tweet,1462683516596936704,
,,CZ  Binance,"In the early days, people used to describe Amazon as a digital version of Barns & Noble.Later, people used to describe Amazon as a digital version of Walmart.",,,,1637462438,,,,Tweet,1462249566120525824,
,,CZ  Binance,This book.,,,,1637457649,,,,Tweet,1462229481565818880,
,,CZ  Binance,"Reading a book about Warren Buffett. It’s clear no one knew how to value stocks a few decades ago, maybe even today. The models/formulae don’t represent true value, they are just calculations that arrive at one opinion.",,,,1637457418,,,,Tweet,1462228510219456512,
,,CZ  Binance,Change is in the air.,,,,1637417352,,,,Tweet,1462060460140683264,
,,CZ  Binance,Doing things has risks. Not doing things is usually a bigger risk.,,,,1637402295,,,,Tweet,1461997306727731200,
,,CZ  Binance,"We've noticed a small problem causing some withdrawals to fail. We're working on it.If your withdrawal fails, please resubmit your withdrawal request. Sorry for the inconvenience",,,,1637337961,,,,Tweet,1461727473360637952,
,['https:\\/\\/t.co\\/QhU6dEDU74'],CZ  Binance,Support layer 2s. Support multiple blockchains. Inclusive platform.,,,,1637300012,,,,Tweet,1461568302237376512,
,,CZ  Binance,Will be live from the Bloomberg Conference in a minute.,,,,1637293058,,,,Tweet,1461539136158851072,
,['https:\\/\\/t.co\\/XZoTXYlm19'],CZ  Binance,Careful what you wish for...,,,,1637205676,,,,Tweet,1461172628916293632,
,['https:\\/\\/t.co\\/qud7BGqElf'],CZ  Binance,"» Q&A: Binance CEO on bubbles, meme coins and crypto's swings",,,,1637198938,,,,Tweet,1461144366492176384,
,,CZ  Binance,Don’t just be busy. Be useful busy. #BNB,,,,1637183416,,,,Tweet,1461079264518762496,
,,CZ  Binance,"Meeting in person is better than live TV, @flacqua",,,,1637164006,,,,Tweet,1460997853287837696,
,,CZ  Binance,"My old boss’ boss, Mr. Bloomberg. So I asked him, hope you won’t be offended if I asked for a selfie. He said, I would be offended if you didn’t. Great dude.",,,,1637159762,,,,Tweet,1460980049390157824,
,,CZ  Binance,"He also talked about decentralized organizations and how you have to meet in person. I was like, hmm… I haven’t met a lot of people in person.",,,,1637159481,,,,Tweet,1460978873345003520,
,,CZ  Binance,PM Lee mentioned #NFT and #bitcoin during this gala dinner 1 min ago.  Photo taken by me.,,,,1637153428,,,,Tweet,1460953486040834048,
,,CZ  Binance,Got my IG account back. Thank you!,,,,1637143557,,,,Tweet,1460912082665099264,
,,CZ  Binance,#BSC ATH on Txs: 14.8M ; Daily Active addresses >2m.Follow the users.,,,,1637142536,,,,Tweet,1460907797827108864,
,,CZ  Binance,"There will be many many dips, corrections and bear/bull markets. Regardless, the technology and industry will continue to grow.",,,,1637138719,,,,Tweet,1460891790173609984,
,['https:\\/\\/t.co\\/aAT8SrsCgy'],CZ  Binance,Bloomberg interview.,,,,1637128329,,,,Tweet,1460848209685725184,
,,CZ  Binance,#Binance,,,,1637108423,,,,Tweet,1460764719355023360,
,,CZ  Binance,What’s your way of explaining crypto to a newcomer?,,,,1637102587,,,,Tweet,1460740240843304960,
,,CZ  Binance,Thank you for following me!,,,,1637080414,,,,Tweet,1460647239269769216,
,,CZ  Binance,Would love to have a blue tick while at it too... Or am I getting too greedy?,,,,1637080351,,,,Tweet,1460646977239085056,
,,CZ  Binance,"My Instagram account was locked, the minute after I gave the account details to our intern, a few weeks ago. Anyone know anyone at IG that can help unlock it? Tried official channels, no luck. And no, I don't have a direct channel with Zuck. Instagram Id: changpengzhao",,,,1637080066,,,,Tweet,1460645781065515008,
,,CZ  Binance,"Our first ad ever, on Financial Times.",,,,1637061049,,,,Tweet,1460566018279968768,
,,CZ  Binance,How #Binance plans to welcome the next billion crypto users.,,,,1637053581,,,,Tweet,1460534697017036800,
,,CZ  Binance,Live now.,,,,1636988735,,,,Tweet,1460262711825080320,
,,CZ  Binance,Will be Live on CNBC in a minute.,,,,1636976376,,,,Tweet,1460210874820349952,
,['https:\\/\\/t.co\\/GSmBxBEfvW'],CZ  Binance,".@CoinMarketCap is now the #67 most visited website in the world, according to Alexa.",,,,1636931694,,,,Tweet,1460023464685830144,
,,CZ  Binance,Crypto never sleeps.,,,,1636931136,,,,Tweet,1460021125669289984,
,,CZ  Binance,Most of the comments on Twitter is not that useful. Agree?,,,,1636909620,,,,Tweet,1459930878637793280,
,,CZ  Binance,Learned something new today: study to earn. Damn…,,,,1636902196,,,,Tweet,1459899741320273920,
,,CZ  Binance,Spent 2 weeks in France. Super impressed by its vibrant tech ecosystem and talents. President Macron did an incredible job. So much to do here. More to come.,,,,1636797244,,,,Tweet,1459459539808309248,
,,CZ  Binance,Marketing team sent me this. #Binance taxis in Ukraine.,,,,1636792008,,,,Tweet,1459437577560338432,
,,CZ  Binance,"In 2001, any CTO who says they aren’t looking at the internet would probably be fired on the spot. In 2021, any CFO who aren’t looking at …",,,,1636711808,,,,Tweet,1459101195507752960,
,,CZ  Binance,"Don’t spend time attacking people. Don’t spend your time on the people you hate.Instead, spend time on building your own products, spend time on yourself.Some people still don’t get this.Time is the most limited resource.",,,,1636667778,,,,Tweet,1458916521355403264,
,,CZ  Binance,"J: Binance became the world’s largest exchange because your logo color is yellow, right?me: ... hmm, fancy.How about just the basics? Product, service, and protecting users.There is no secret sauce.",,,,1636645911,,,,Tweet,1458824803947843584,
,,CZ  Binance,"Season 1 & 2 did extremely well, including some of the best projects that went through Binance Launchpad.",,,,1636644712,,,,Tweet,1458819773509390336,
,,CZ  Binance,Crypto will change the sports economy.,,,,1636588863,,,,Tweet,1458585527641378816,
,,CZ  Binance,Keep building.,,,,1636573156,,,,Tweet,1458519645598765056,
,,CZ  Binance,Let's make it trend.,,,,1636564098,,,,Tweet,1458481655681896448,
,,CZ  Binance,#Bitcoin,,,,1636563844,,,,Tweet,1458480588961337344,
,,CZ  Binance,Manchester,,,,1636534624,,,,Tweet,1458358032937664512,
,['https:\\/\\/t.co\\/D5h4cIvQP5'],CZ  Binance,.@BinanceBCF - how blockchain technology can help combat modern-day slavery.,,,,1636530997,,,,Tweet,1458342820276850688,
,,CZ  Binance,#BinanceForAll #Binance,,,,1636522529,,,,Tweet,1458307302579130368,
,,CZ  Binance,"Don’t worry about competition. It will make your industry bigger, which in turn helps you. Embrace it!",,,,1636501841,,,,Tweet,1458220531304501248,
,['https:\\/\\/t.co\\/swU5HxO5JQ'],CZ  Binance,Probably not a big deal.,,,,1636477209,,,,Tweet,1458117216969183232,
,,CZ  Binance,In person AMA in an hour. See you there.,,,,1636476651,,,,Tweet,1458114876912459776,
,,CZ  Binance,K-pop NFT. I have always been a secret fan.,,,,1636465776,,,,Tweet,1458069261600100352,
,,CZ  Binance,Don’t fight technology innovation. It won’t stop. Be with it.,,,,1636457337,,,,Tweet,1458033867517009920,
,,CZ  Binance,"It's normal, it's expected. Don't get overly excited. Keep building.",,,,1636446553,,,,Tweet,1457988637128286208,
,,CZ  Binance,"If you want to help a person for a day, give them crypto. If you want to help a person for a life time, teach them #crypto.",,,,1636391554,,,,Tweet,1457757951230418944,
,,CZ  Binance,"On prices, some take a short term analysis approach, I take a slightly longer one.Bitcoin halving 1.5 years agoDeFiNFTsGameFiFan Tokensand of course, ETFs and much more...",,,,1636364843,,,,Tweet,1457645919759962112,
,,CZ  Binance,Was surprised they didn't ask me about price.,,,,1636364821,,,,Tweet,1457645827074240512,
,,CZ  Binance,Looks like I will be live on Bloomberg TV London in a few minutes. Putting on a #Binance polo shirt.,,,,1636363590,,,,Tweet,1457640664750075904,
,,CZ  Binance,GM,,,,1636302293,,,,Tweet,1457383567189848064,
,,CZ  Binance,"I don’t hate anyone, but who invented ties.",,,,1636298930,,,,Tweet,1457369458893279232,
,,CZ  Binance,#BNB,,,,1636219699,,,,Tweet,1457037139246469120,
,,CZ  Binance,"I asked the waiter for the bill, he asked me back: which coin?",,,,1636211101,,,,Tweet,1457001076390043648,
,,CZ  Binance,#BNB,,,,1636210097,,,,Tweet,1456996867619934208,
,,CZ  Binance,"Do it fast, with quality.10x faster, 1.2x quality.And win.",,,,1636196340,,,,Tweet,1456939166579793920,
,,CZ  Binance,Help grow every blockchain.,,,,1636195920,,,,Tweet,1456937405165023232,
,,CZ  Binance,Probably nothing.,,,,1636121006,,,,Tweet,1456623192320135168,
,,CZ  Binance,We have only just begun to scratch the surface of the full potential of blockchain.,,,,1636118645,,,,Tweet,1456613289924907008,
,,CZ  Binance,Game on.,,,,1636118264,,,,Tweet,1456611693367267328,
,,CZ  Binance,#Binance,,,,1636109483,,,,Tweet,1456574861594214400,
,,CZ  Binance,Follow the users.,,,,1636101321,,,,Tweet,1456540628456775680,
,,CZ  Binance,"#BSC had about 2,000,000 active addresses yesterday, about 5-10x of other blockchains.",,,,1636101269,,,,Tweet,1456540407584727040,
,,CZ  Binance,"Don’t FOMO, please.",,,,1636063142,,,,Tweet,1456380492434059264,
,,CZ  Binance,There are so many museums in Paris. It’s unfathomable.…So much to NFT.,,,,1636025640,,,,Tweet,1456223199524499456,
,['https:\\/\\/t.co\\/l7pivwatTc'],CZ  Binance,"The co-founder of #Binance, @heyibinance, talks regulation, global growth of crypto markets, and the firm's search for a physical headquarters - @MktsInsider",,,,1636019955,,,,Tweet,1456199355766038528,
,,CZ  Binance,"A Binance team member meets me and says, “CZ, I am so happy to meet you, I have been working for Binance for 2.5 years and you are the 3rd guy I have met in person.”Decentralization has its downsides.",,,,1635977493,,,,Tweet,1456021256524861440,
,,CZ  Binance,"Not bragging, but crypto has come a long way from 20 people meet ups in coffee shops in 2014 to live-streaming events directly from the Ministry of Economy and Finance. Keep building.",,,,1635972874,,,,Tweet,1456001881189150720,
,,CZ  Binance,There is always a bigger boss.,,,,1635933845,,,,Tweet,1455838180712882176,
,,CZ  Binance,WiFi/Internet still don't work well at times. It's only been 30+ years. Build takes time. Focus on the long term.,,,,1635928081,,,,Tweet,1455814007458308096,
,,CZ  Binance,The nation to become the leader in crypto wins. Simple as that.,,,,1635881110,,,,Tweet,1455616997614624768,
,,CZ  Binance,Don’t be a default.#Metaverse #crypto #bnb,,,,1635786585,,,,Tweet,1455220529539940352,
,,CZ  Binance,"(,)",,,,1635784288,,,,Tweet,1455210894506483712,
,,CZ  Binance,We're on it. Funds are SAFU.,,,,1635766780,,,,Tweet,1455137460028067840,
,,CZ  Binance,New intern on the listing team. Brilliant!,,,,1635760283,,,,Tweet,1455110208976478208,
,,CZ  Binance,"Photo from Snowbird, Utah, 18 years ago. I am old…",,,,1635695788,,,,Tweet,1454839697100902400,
,,CZ  Binance,An old photo. My friend immediately pointed out how the #binance  logo came to be…,,,,1635695588,,,,Tweet,1454838858391097344,
,,CZ  Binance,"Want to be king? Simple, treat your users as god.",,,,1635694954,,,,Tweet,1454836200896974848,
,,CZ  Binance,There is so much more to build.,,,,1635527173,,,,Tweet,1454132476486434816,
,,CZ  Binance,Focus on the long term.,,,,1635522789,,,,Tweet,1454114088360071168,
,,CZ  Binance,When Launchpool?,,,,1635408747,,,,Tweet,1453635763325841408,
,,CZ  Binance,"Business communication tip: distill your message to the most important points, and say it in the most concise manner possible. Makes everything so much easier.",,,,1635407705,,,,Tweet,1453631392408031232,
,,CZ  Binance,voilà,,,,1635405779,,,,Tweet,1453623312454672384,
,,CZ  Binance,Bonjour,,,,1635404287,,,,Tweet,1453617054356054016,
,,CZ  Binance,The industry is growing.,,,,1635248496,,,,Tweet,1452963618799202304,
,,CZ  Binance,"I bought a van, Toyota alphard. Can no longer say I don’t have a car.",,,,1635084638,,,,Tweet,1452276348794310656,
,,CZ  Binance,"I am flattered, floored, and humbled. Thank you",,,,1635005111,,,,Tweet,1451942788753358848,
,,CZ  Binance,"There’s been a lot of FUD around @CoinMarketCap. To the best of our knowledge, there are no leaks from CMC. There are partial matches on emails, no passwords. It is likely collected through mailing lists, etc. Still investigating.",,,,1634984250,,,,Tweet,1451855293059584000,
,,CZ  Binance,2 BTC,,,,1634932720,,,,Tweet,1451639158011727872,
,,CZ  Binance,"This is ON TOP of the 100m #BNB burn committed by @binance. Only a few may understand burns, which makes it even more attractive.",,,,1634894272,,,,Tweet,1451477897668186112,
,,CZ  Binance,Don't be late.,,,,1634851314,,,,Tweet,1451297719679586304,
,['https:\\/\\/t.co\\/tJMeBRVoIg'],CZ  Binance,$140 billion yesterday. #Binance,,,,1634850763,,,,Tweet,1451295407083069440,
,,CZ  Binance,"In the first 15 minutes of trading, LAZIO did more than $150m USD worth of trading. 22x increase in price from Launchpad, giving it close to $1 billion in market cap.A new chapter has began, fan tokens.",,,,1634818750,,,,Tweet,1451161134413852672,
,,CZ  Binance,Don't get distracted. Keep building.,,,,1634818032,,,,Tweet,1451158122920349696,
,,CZ  Binance,$LAZIO (fan token) is the most participated Launchpad project ever. Trading starts in 3 minutes.,,,,1634817330,,,,Tweet,1451155179999485952,
,,CZ  Binance,Expect very high volatility in #crypto over the next few months.,,,,1634817158,,,,Tweet,1451154457002225664,
,,CZ  Binance,100 billion traded yesterday on #binance,,,,1634780314,,,,Tweet,1450999923835645952,
,,CZ  Binance,"Risk management, be ready to enjoy the best case, be ready to handle the worst case. Don’t invest more than you can lose.",,,,1634759282,,,,Tweet,1450911708411834368,
,,CZ  Binance,If you have ever sold #bitcoin…,,,,1634741847,,,,Tweet,1450838580386009088,
,,CZ  Binance,ATH,,,,1634741564,,,,Tweet,1450837393809018880,
,,CZ  Binance,Most people still don’t have #Bitcoin.,,,,1634712067,,,,Tweet,1450713675803906048,
,,CZ  Binance,good morning,,,,1634679785,,,,Tweet,1450578274577494016,
,,CZ  Binance,Did you ever doubt it?,,,,1634665034,,,,Tweet,1450516401848872960,
,,CZ  Binance,"Just took $639,000,000 USD worth of #BNB  out of circulation, permanently.",,,,1634569247,,,,Tweet,1450114642223718400,
,,CZ  Binance,I smell #BNB,,,,1634558549,,,,Tweet,1450069771144376320,
,['https:\\/\\/t.co\\/4LN8Z3MznK'],CZ  Binance,Happy to talk to anyone at conferences. A self intro great. But please don’t pitch projects. It just doesn’t work in a conference environment. I don’t look at projects anyway.,,,,1634542776,,,,Tweet,1450003615570186240,
,,CZ  Binance,"Don’t subscribe to: “if it ain’t broken, don’t fix it.”Subscribe to: disrupt yourself or be disrupted.The world is changing fast these days.",,,,1634508775,,,,Tweet,1449861004393857024,
,['https:\\/\\/t.co\\/PqbI459bKH'],CZ  Binance,"Don't put one leg up, especially not on stage.",,,,1634487740,,,,Tweet,1449772777175764992,
,,CZ  Binance,Win. @OfficialSSLazio,,,,1634478255,,,,Tweet,1449732995892400128,
,,CZ  Binance,Good morning. Humbled.,,,,1634454386,,,,Tweet,1449632881446359040,
,,CZ  Binance,Q: work or pleasure?Me: both.,,,,1634445492,,,,Tweet,1449595576723460096,
,,CZ  Binance,"Thank you for coming to the #Binance meetup today. Was great to see you all, after so long.",,,,1634419710,,,,Tweet,1449487439752531968,
,,CZ  Binance,I see a trend here…,,,,1634419385,,,,Tweet,1449486076045930496,
,,CZ  Binance,"Just finished the AMA, will come back later to just hang. Don’t want to disrupt the flow of the meetup.",,,,1634406148,,,,Tweet,1449430556404498432,
,,CZ  Binance,"Yalla, join us.",,,,1634395532,,,,Tweet,1449386031552290816,
,['https:\\/\\/t.co\\/nKGD6r1gQz'],CZ  Binance,What is a burn?  #BNB,,,,1634364801,,,,Tweet,1449257132893802496,
,,CZ  Binance,"There are always more opportunities in the future than in the past.Don't worry about ""missed"" opportunities.Don't worry about small temporary setbacks.Ideas are worthless.Execution is key.#Build",,,,1634364118,,,,Tweet,1449254271254417408,
,,CZ  Binance,Yalla,,,,1634325352,,,,Tweet,1449091675394125824,
,,CZ  Binance,,,,,1634309882,,,,Tweet,1449026788840116224,
,,CZ  Binance,Just had an issue on futures. A small number of users are affected. We will compensate for any losses incurred for those affected. Further details will be announced/communicated.,,,,1634228939,,,,Tweet,1448687289345925120,
,,CZ  Binance,Sitting beside @Eljaboom at dinner now. Meeting in person rocks. Finally putting a face to the name. Thank you for your support always.,,,,1634227974,,,,Tweet,1448683241964294144,
,,CZ  Binance,16th,,,,1634224845,,,,Tweet,1448670115386515456,
,,CZ  Binance,#bitcoin is pretty close though.,,,,1634224357,,,,Tweet,1448668069006659584,
,,CZ  Binance,#bitcoin is not the most limited supply asset. Time is.,,,,1634223595,,,,Tweet,1448664872976195584,
,,CZ  Binance,@OfficialSSLazio,,,,1634128616,,,,Tweet,1448266501644070912,
,,CZ  Binance,Gotta love that jersey...,,,,1634128496,,,,Tweet,1448265998839259136,
,,CZ  Binance,"Work hard, #build. #BNB.",,,,1634123158,,,,Tweet,1448243609678106624,
,['https:\\/\\/t.co\\/NkzubbRGX8'],CZ  Binance,Fan Tokens.,,,,1634120352,,,,Tweet,1448231840318382080,
,,CZ  Binance,"Crypto, CEX, ICO/IEO, DeFi, NFTs, GameFi, Metaverse, and then ... what's next?",,,,1634105867,,,,Tweet,1448171084956712960,
,,CZ  Binance,A billion reasons to #buidl on #BSC,,,,1634045526,,,,Tweet,1447917997444763648,
,,CZ  Binance,Which coin should we list or increase pairing next?,,,,1634030983,,,,Tweet,1447857001921490944,
,,CZ  Binance,"While price swings up and down, technology innovation progress only in one direction. Focus on the long term. #bitcoin",,,,1634027841,,,,Tweet,1447843823770537984,
,,CZ  Binance,It is irresponsible to not learn about blockchain.,,,,1633820783,,,,Tweet,1446975359359098880,
,['https:\\/\\/t.co\\/JPlEXnK8wG'],CZ  Binance,We try…,,,,1633717569,,,,Tweet,1446542448684150784,
,,CZ  Binance,Keep it simple. Keep it fast.,,,,1633677587,,,,Tweet,1446374748548706304,
,,CZ  Binance,I need more…,,,,1633544072,,,,Tweet,1445814749954908160,
,,CZ  Binance,"First #bitcoin, then...",,,,1633525041,,,,Tweet,1445734925110366208,
,,CZ  Binance,Inshallah,,,,1633348738,,,,Tweet,1444995455918673920,
,['https:\\/\\/t.co\\/hFSsrdp2Gl'],CZ  Binance,#Binance Academy is available in Arabic.,,,,1633234549,,,,Tweet,1444516514124677120,
,,CZ  Binance,"There was an interesting discussion about putting embassies in the metaverse.Immersive experienceEasier to access, globallyTrendy with the next generationBlockchain level authenticitymuch lower cost than physical buildingswhat else?",,,,1633234048,,,,Tweet,1444514414745595904,
,['https:\\/\\/t.co\\/GSmBxBmEEo'],CZ  Binance,".@CoinMarketCap is now a top 100 website in the world, as ranked by Alexa. Thank you for your support!",,,,1633152827,,,,Tweet,1444173747276091392,
,['https:\\/\\/t.co\\/V9OUbfGsOh'],CZ  Binance,"""#Binance, the world’s biggest cryptocurrency exchange, hired a former U.S. Internal Revenue Service special agent who worked on some of the digital-asset world’s most high-profile investigations.""",,,,1633032352,,,,Tweet,1443668436941430784,
,,CZ  Binance,"Blockchain is not the future, it is the present.(quoting a very traditional investor I met today)Don’t be left behind.",,,,1632933012,,,,Tweet,1443251775398506496,
,,CZ  Binance,When #Binance Launchpad?,,,,1632926170,,,,Tweet,1443223078482235392,
,,CZ  Binance,"4 years ago this month, #bitcoin made an ATH of $5000 on Sept 1, then ""crashed"" to $3000 by Sept 14. The rest, well, you know...",,,,1632829669,,,,Tweet,1442818323637424128,
,,CZ  Binance,#BinanceSmartChain,,,,1632805688,,,,Tweet,1442717742101004288,
,,CZ  Binance,We are beginning to spot these in the wild.,,,,1632746983,,,,Tweet,1442471513395896320,
,,CZ  Binance,"Purpose. Single, not plural, typo.",,,,1632671688,,,,Tweet,1442155705205624832,
,,CZ  Binance,Everybody needs a purposes.,,,,1632671367,,,,Tweet,1442154356359393280,
,,CZ  Binance,"While ESOPs typically vest over a 4 year period, they usually don't have liquidity until IPO (which usually takes a few more years at best). Tokens are different, they have liquidity as soon as they unlock.",,,,1632540837,,,,Tweet,1441606874218975232,
,,CZ  Binance,"Unpopular opinion: project founder tokens should unlock over a 10 year period, not shorter. Ie, not 4 year, definitely not 1.5 year periods. Must have long term commitment.",,,,1632538552,,,,Tweet,1441597293245829120,
,['https:\\/\\/t.co\\/JdypGOw8W1'],CZ  Binance,Yesterday’s actions taken by the US Treasury Department against “bulletproof exchangers” like Suex is a POSITIVE development for the industry and the future trajectory of crypto. (1/3),,,,1632364523,,,,Tweet,1440867358923317248,
,,CZ  Binance,Binance partners with law enforcement agencies across the globe on a daily basis to stamp out illicit activities in the crypto ecosystem. I am confident that we have the most sophisticated processes and technology in place to identify and thwart bad actors in the industry. (2/3),,,,1632364523,,,,Tweet,1440867360634593280,
,['https:\\/\\/t.co\\/JdypGOw8W1'],CZ  Binance,It’s imperative that we as an industry continue to partner with regulators and law enforcement in pursuit of our mutual goal of creating a more secure ecosystem for users. Today’s announcement is a sign that the industry is here to stay. More here:,,,,1632364523,,,,Tweet,1440867362110984192,
,,CZ  Binance,"In the long run, it’s called a dip.",,,,1632296149,,,,Tweet,1440580578097598464,
,,CZ  Binance,Live now.,,,,1632234461,,,,Tweet,1440321841579524096,
,,CZ  Binance,Happy Mid Autumn (Moon) Festival!,,,,1632233637,,,,Tweet,1440318386194378752,
,,CZ  Binance,I still have one of these with me to give away.,,,,1632207690,,,,Tweet,1440209555623866368,
,,CZ  Binance,#Bitcoin is never against anyone.,,,,1632135797,,,,Tweet,1439908012731240448,
,,CZ  Binance,Legend,,,,1632132277,,,,Tweet,1439893252577005568,
,,CZ  Binance,I am bullish.,,,,1631984210,,,,Tweet,1439272212779859968,
,,CZ  Binance,Don't get distracted by noise.,,,,1631935587,,,,Tweet,1439068270955413504,
,,CZ  Binance,5M,,,,1631928097,,,,Tweet,1439036859263246336,
,,CZ  Binance,Invest in the industry. Be blockchain agnostic.,,,,1631885995,,,,Tweet,1438860269132738560,
,,CZ  Binance,80% of success is just being there. Get involved.,,,,1631837117,,,,Tweet,1438655259711180800,
,,CZ  Binance,AMA using a Livestream mini-app in the #Binance Mini Program Market Place. (Screenshot from a colleague as I as focused on talking.) Thank you for tuning in and thank you for your support!,,,,1631804848,,,,Tweet,1438519913916686336,
,,CZ  Binance,AMA on #Binance Live later today.,,,,1631782699,,,,Tweet,1438427012754984960,
,,CZ  Binance,"We live in a world where it is bad to discriminate based on color, age, sex, etc. But it is ok to label someone a “not accredited investor”, the default assumption. Isn’t that like saying someone is not smart enough to invest or manage their own finances? More education needed.",,,,1631766872,,,,Tweet,1438360629073481728,
,['https:\\/\\/t.co\\/ubBR3wUjZJ'],CZ  Binance,"Binance Coin 4-year return a whopping 42,600% - Financial Mirror",,,,1631754701,,,,Tweet,1438309580526653440,
,,CZ  Binance,When you were panicking…,,,,1631535217,,,,Tweet,1437388999983710208,
,['https:\\/\\/t.co\\/n6qSKq27qi'],CZ  Binance,"How GoCrypto, Binance Pay Alliance Could Boost Crypto’s Mass Adoption",,,,1631415265,,,,Tweet,1436885885836877824,
,"['https:\\/\\/t.co\\/hSHrrlWIfF', 'https:\\/\\/t.co\\/wnz9F9BJaM']",CZ  Binance,,,,,1631415042,,,,Tweet,1436884950586839040,
,,CZ  Binance,"Red pill, always.",,,,1631377145,,,,Tweet,1436725998007959552,
,,CZ  Binance,"Last week, we saw traffic, users and customer support numbers at or close to ATH again. Let's see what follows.",,,,1631344667,,,,Tweet,1436589774337241088,
,,CZ  Binance,#bitcoin continues to grow.,,,,1631344561,,,,Tweet,1436589328478601216,
,,CZ  Binance,5 more languages added to @CoinMarketCap mobile app last week.PortugueseHindiChinese TraditionalPolishUkrainian,,,,1631324267,,,,Tweet,1436504210317590528,
,,CZ  Binance,Sending crypto to friends just got easier with #Binance Pay (directly in the Binance App).,,,,1631254063,,,,Tweet,1436209754511056896,
,,CZ  Binance,NFTs will create the next Renaissance art period.,,,,1631247370,,,,Tweet,1436181681577160704,
,,CZ  Binance,Happy birthday @BinanceTR,,,,1631202519,,,,Tweet,1435993563595165696,
,,CZ  Binance,"There is so much mis-information in the world that if you believe everything you read, you will be quite poor.",,,,1631157210,,,,Tweet,1435803524315549696,
,,CZ  Binance,"""news"": binance banned in SG.Facts: Binance Singapore, an independent entity, is operating in Singapore. It is operating under the specific exemption of MAS, while going through the licensing application process.",,,,1631156367,,,,Tweet,1435799987229638656,
