re_tweeter,links,author,text,hashtags,reply_count,associated_tweet,timestamp,mentions,author_id,retweet_count,type,id,favorite_count
,['https:\\/\\/t.co\\/TsTR1EU0C6'],CZ  Binance,AMC's lets you buy tickets with crypto. Surprise surprise.,,,,1650052633,,,,Tweet,1515056672531795968,
,,CZ  Binance,Russia will legalize crypto for payments. Surprise surprise.,,,,1650052501,,,,Tweet,1515056118392893440,
,,CZ  Binance,France is a great place for entrepreneurship.,,,,1650041610,,,,Tweet,1515010437083021312,
,,CZ  Binance,"Love the public take over of Twitter, using Twitter.",,,,1650041259,,,,Tweet,1515008967038099456,
,['https:\\/\\/t.co\\/hGyNn1SMGw'],CZ  Binance,"Clean mixers, compliant while providing privacy. Never used one myself. But interesting!",,,,1650040955,,,,Tweet,1515007691424518144,
,,CZ  Binance,"If at 25, you are looking for ""work-life-balance"", then after 20 years, you will still be working hard to get a good life.Life becomes better when you work hard early.",,,,1650016094,,,,Tweet,1514903416857927680,
,,CZ  Binance,,,,,1650011979,,,,Tweet,1514886156302888960,
,['https:\\/\\/t.co\\/znPHLsi8M6'],CZ  Binance,Video interview about crypto & France.,,,,1649990289,,,,Tweet,1514795180158685184,
,['https:\\/\\/t.co\\/8Wv7ap1BCG'],CZ  Binance,#Binance Pool officially supports Litecoin's Mimblewimble Extension Block (MWEB) upgrade.»,,,,1649935926,,,,Tweet,1514567168381394944,
,,CZ  Binance,"Privatize it, issue a token, decentralize it.Cost per blue tick accounts to reduce spam/scam. NFTs, metaverse...",,,,1649932291,,,,Tweet,1514551919565492224,
,['https:\\/\\/t.co\\/LmUuSqPEUg'],CZ  Binance,,,,,1649920959,,,,Tweet,1514504388718600192,
,,CZ  Binance,Entrepreneurship is a physical job. Gotta have stamina.,,,,1649920296,,,,Tweet,1514501610763866112,
,,CZ  Binance,Earlier today.,,,,1649854861,,,,Tweet,1514227156670369792,
,,CZ  Binance,At the #binance booth.,,,,1649844529,,,,Tweet,1514183819217317888,
,['https:\\/\\/t.co\\/rVgKxeuhST'],CZ  Binance,"Never understood why some people think fiat money is ""stable"". Nothing is stable when benchmarked against something else. And that something else should be purchasing power.",,,,1649822046,,,,Tweet,1514089517866696704,
,,CZ  Binance,Web3 does sound better than crypto. Ask everyone around you: are you still in web 2 or are you using web 3?,,,,1649820923,,,,Tweet,1514084807172632576,
,,CZ  Binance,"You became 8.5% poorer, if you held fiat.",,,,1649773673,,,,Tweet,1513886628904943616,
,,CZ  Binance,"You became 8.5% poorer, if you held fiat.",,,,1649773661,,,,Tweet,1513886577616990208,
,,CZ  Binance,"For those who don't know, this is the stock exchange building in Paris. They are progressive enough to let a crypto exchange to hang a banner on the building.",,,,1649765794,,,,Tweet,1513853580880580608,
,,CZ  Binance,"#bitcoin is volatile, but it's not going away.",,,,1649764042,,,,Tweet,1513846233659547648,
,,CZ  Binance,,,,,1649763897,,,,Tweet,1513845624415961088,
,,CZ  Binance,#Binance,,,,1649756072,,,,Tweet,1513812804851187712,
,,CZ  Binance,"Good to see them getting that to the top of the building, lol",,,,1649755831,,,,Tweet,1513811794774614016,
,,CZ  Binance,"In crypto, startups have funds to invest in other startups.",,,,1649754968,,,,Tweet,1513808173387464704,
,,CZ  Binance,"Don't say ""I will make my presentation quick"". Saying that wastes time. Just make it quick.",,,,1649750408,,,,Tweet,1513789046857818112,
,,CZ  Binance,See you soon.,,,,1649741433,,,,Tweet,1513751405835784192,
,,CZ  Binance,"When the titanic sinks, little floats near it get dragged down too. But the floats will eventually come back up, if they are untethered.",,,,1649737418,,,,Tweet,1513734563415085056,
,,CZ  Binance,j'étudie le français,,,,1649734905,,,,Tweet,1513724024538472448,
,,CZ  Binance,Abu Dhabi,,,,1649705153,,,,Tweet,1513599234515292160,
,['https:\\/\\/t.co\\/zjOVFOaT98'],CZ  Binance,"Damn, looks like we need to do our share...Source:",,,,1649658123,,,,Tweet,1513401977048338432,
,['https:\\/\\/t.co\\/r4uzQEOZcg'],CZ  Binance,» India Will Be A Natural Frontrunner For Web3 Startups: Binance CEO,,,,1649657232,,,,Tweet,1513398239789301760,
,['https:\\/\\/t.co\\/06pcDFCnqY'],CZ  Binance,"Not the greatest title, but good to see the collaboration between industry and policymakers.» Crypto Industry Helps Write, and Pass, Its Own Agenda in State Capitols - The New York Times",,,,1649657043,,,,Tweet,1513397446335991808,
,,CZ  Binance,Why join a board where you have to sit through long meetings when you can just tweet?,,,,1649649862,,,,Tweet,1513367325545750528,
,,CZ  Binance,Build things other people use.,,,,1649644718,,,,Tweet,1513345751526612992,
,,CZ  Binance,"This came up again: ""but bitcoin is not 'real' like gold, why does it have value?""If something is use by people, it has value. Many non-physical tools have value. Google, Facebook (& #bitcoin) don't have physical stuff, but people use it, so they have value. Utility value.",,,,1649644717,,,,Tweet,1513345747256848896,
,,CZ  Binance,"#bitcoin/crypto is used as tools for: transactions (domestic and international); globally fundraising (startups and donations); selling art and content, hedge against inflation, providing liquidity, earn interest, and much more... by more than 500 million people.",,,,1649644717,,,,Tweet,1513345749333037056,
,,CZ  Binance,"Just came across this new term ""impact investing"". Google it. It put ""maximizing shareholder value"" at a lower priority. Guess what, when you issue a token to raise funds, you don't have shareholders. Your token holders are likely your users. Maximize user value.",,,,1649619570,,,,Tweet,1513240272485900288,
,['https:\\/\\/t.co\\/Za0Lnk5ejO'],CZ  Binance,Slowly but surely. » Binance Gets Abu Dhabi Crypto Nod,,,,1649581765,,,,Tweet,1513081709310648320,
,['https:\\/\\/t.co\\/FiUae5PBXb'],CZ  Binance,Wasn't this obvious from 2 years ago?,,,,1649579591,,,,Tweet,1513072588871942144,
,,CZ  Binance,"A team member: boss, you know I haven't taken a vacation for 4 years.Me: Oh, why didn't you?A: Because you never did.Me: oh...A: You need to take some vacation man, so that we can do too.Me: ok",,,,1649523443,,,,Tweet,1512837086570766336,
,,CZ  Binance,People in Shanghai really running out of food now. Haven't figured out how we can help yet... Tricky.,,,,1649487066,,,,Tweet,1512684510315429888,
,['https:\\/\\/t.co\\/Q92Y9youwu'],CZ  Binance,» Binance poaches FCA official as global regulation head,,,,1649485732,,,,Tweet,1512678918247133184,
,['https:\\/\\/t.co\\/VNROZ6lT8n'],CZ  Binance,Doing our bit.,,,,1649485430,,,,Tweet,1512677651286302720,
,,CZ  Binance,Honduran special economic zone adopts #bitcoin as legal tender.,,,,1649416171,,,,Tweet,1512387158178516992,
,,CZ  Binance,"Global food prices rise 34% in March…, rising by the fastest rate in 14 years. published by the UN Food and Agricultural Organisation,",,,,1649408378,,,,Tweet,1512354469736026112,
,['https:\\/\\/t.co\\/nHg1LEIEqA'],CZ  Binance,#WenBinance ?,,,,1649403496,,,,Tweet,1512333994955841536,
,,CZ  Binance,"Bitcoin don't pay anyone salaries, yet we work for it willingly.",,,,1649382325,,,,Tweet,1512245194250498048,
,,CZ  Binance,.@BinanceBCF,,,,1649366984,,,,Tweet,1512180851261509632,
,,CZ  Binance,,,,,1649344386,,,,Tweet,1512086069000302592,
,,CZ  Binance,"Adoption continues. Once one does it, everyone jumps in. Few want to be first. But no one want to be last.Imagine if you are the last country to adopt crypto as a legal tender. What does that say about you?",,,,1649344212,,,,Tweet,1512085338667118592,
,,CZ  Binance,"Khabib is one of the most humble, down-to-earth, and smart guys I have met. Perfect fighting machine of course, but very low key in person. Oh, I thought about asking him to come along when Mike Tyson sent that slightly ambiguous fun message, haha.",,,,1649343113,,,,Tweet,1512080728208465920,
,,CZ  Binance,"UFC will pay its fighters bonuses in crypto.Photo was taken a while back, when I still had hair. Thought it is appropriate to share now.",,,,1649342276,,,,Tweet,1512077219815825408,
,,CZ  Binance,Live with CNBC soon.,,,,1649334648,,,,Tweet,1512045225199423488,
,,CZ  Binance,"Two choices. You can expose yourself early with a constant stream of small disruptions, or you can wait and get shocked by a big disruption sooner or later. There is no 3rd choice. Disruption will happen.",,,,1649326820,,,,Tweet,1512012388907819008,
,,CZ  Binance,UN accepts crypto now.,,,,1649326033,,,,Tweet,1512009088498126848,
,,CZ  Binance,There is a solution to inflation.,,,,1649317045,,,,Tweet,1511971391037493248,
,['https:\\/\\/t.co\\/C9GR2ALVKH'],CZ  Binance,» Yellen: 'We Haven't Seen Significant Evasion' of Sanctions Using Crypto - Decrypt,,,,1649305824,,,,Tweet,1511924325837856768,
,"['https:\\/\\/t.co\\/wszh3IeLTK', 'https:\\/\\/t.co\\/kR7Ze0PP6r']",CZ  Binance,"» Fortune’s Changpeng Zhao Profile, What Did We Learn About Him And Binance? |",,,,1649299350,,,,Tweet,1511897171896979456,
,,CZ  Binance,This iron man #bitcoin bull is pretty cool.,,,,1649294210,,,,Tweet,1511875614713733120,
,,CZ  Binance,Excited for this new chapter.Thanks @BrianShroder and the @BinanceUS team for bringing crypto to more people in the U.S. Keep building.,,,,1649265990,,,,Tweet,1511757253275267072,
,['https:\\/\\/t.co\\/uLRkgMY8mW'],CZ  Binance,CeFi comes to the DeFi rescue.  » Crypto exchange Binance among investors to bail out victims of $615 mln heist | Reuters,,,,1649261380,,,,Tweet,1511737915155623936,
,,CZ  Binance,A small step towards ____.,,,,1649259625,,,,Tweet,1511730552944185344,
,['https:\\/\\/t.co\\/kH368uyvGl'],CZ  Binance,» Sky Mavis Raises $150M Round Led by Binance to Reimburse Ronin Attack Victims,,,,1649251360,,,,Tweet,1511695889060052992,
,['https:\\/\\/t.co\\/intrm5HgpB'],CZ  Binance,"Protect users, protect projects, protect the industry.",,,,1649250676,,,,Tweet,1511693020017704960,
,,CZ  Binance,There is a new technology for money. Do you want to ignore it?,,,,1649236390,,,,Tweet,1511633100861751296,
,,CZ  Binance,"Don’t worry about wealth rankings. They are just opinions.Focus on building value, building product people use.",,,,1649236235,,,,Tweet,1511632449893240832,
,['https:\\/\\/t.co\\/flutDUjsq8'],CZ  Binance,» Dubai lures clutch of big crypto firms with tailored regulations | Financial Times,,,,1649226230,,,,Tweet,1511590487530127360,
,,CZ  Binance,And the incumbents (if they don't embrace innovation) won't exist tomorrow anyway.,,,,1649220138,,,,Tweet,1511564933313568768,
,,CZ  Binance,"You can protect the incumbents, or you can be the winner of tomorrow by embracing innovation/disruption. Rarely both. Tomorrow is the bigger reward though.",,,,1649220031,,,,Tweet,1511564485479260160,
,,CZ  Binance,"When a small exchange owner says @Binance is bad, and they are good. You have to ask, what is the real motive there? And, why do people choose #Binance over them?",,,,1649219257,,,,Tweet,1511561239717191680,
,,CZ  Binance,#Binance,,,,1649188431,,,,Tweet,1511431944755687424,
,['https:\\/\\/t.co\\/XsdFXEtPBs'],CZ  Binance,"Had a great chat with @MattHancock a month ago in London. He is an expert in crypto, and have a forward thinking mindset. Great to see him pushing crypto adoption.",,,,1649174103,,,,Tweet,1511371849476808704,
,,CZ  Binance,I don't buy dips. I don't have fiat.,,,,1649166037,,,,Tweet,1511338019302916096,
,,CZ  Binance,"Many people talk about buying the dip. But when the dip comes, they panic and sell (as oppose to buy).This is how you do it.",,,,1649165891,,,,Tweet,1511337405911080960,
,['https:\\/\\/t.co\\/OrlbwhBNRS'],CZ  Binance,Talking later on @washingtonpost @PostLive about blockchain security.,,,,1649155992,,,,Tweet,1511295887775084544,
,,CZ  Binance,"Out of the dog house, finally! Thanks for everyone's support (covid was mild), and sorry for missing you guys during BBW (boredom was serious).",,,,1649147372,,,,Tweet,1511259731540721664,
,['https:\\/\\/t.co\\/GLX6nKkjaO'],CZ  Binance,» Binance CEO: You can't use cryptocurrency to escape sanctions,,,,1649146753,,,,Tweet,1511257135866335232,
,,CZ  Binance,"Security guard: ""wow, just sent money to my wife using crypto. It went instantly with no fees. It used to take 3 days, with a lot of fees.""I just smile. Adoption. One at a time.",,,,1649131100,,,,Tweet,1511191483059253248,
,,CZ  Binance,UK wants to be a crypto hub.,,,,1649098735,,,,Tweet,1511055731893714944,
,['https:\\/\\/t.co\\/JgYQv2UbD0'],CZ  Binance,,,,,1649093392,,,,Tweet,1511033322901688320,
,,CZ  Binance,"Talking to @MikeTyson in Twitter Spaces in a few minutes. Glad it’s virtual, so I don’t have to wear any boxing wear. Phew.",,,,1649092670,,,,Tweet,1511030295033696256,
,,CZ  Binance,Music + crypto.,,,,1649059262,,,,Tweet,1510890171759304704,
,,CZ  Binance,,,,,1648971276,,,,Tweet,1510521130917974016,
,,CZ  Binance,"Beware of phishing attacks. Never click on links in an email or message, or worst Twitter comments.",,,,1648959992,,,,Tweet,1510473800743374848,
,,CZ  Binance,"When Mike says that, how do you respond?",,,,1648958574,,,,Tweet,1510467854436605952,
,,CZ  Binance,Difference in narrative.,,,,1648923838,,,,Tweet,1510322162535645184,
,,CZ  Binance,Things are often not what it seems on the surface. And don't be fooled by one sided narratives.,,,,1648922038,,,,Tweet,1510314612713050112,
,,CZ  Binance,"According to the book ""Numbers Don't Lie"", More than 60% of the electricity used to power EV (electric vehicles) comes from fossil carbon. They are still ""coal cars"". EV tech is great, but still need to fix problems at the source.",,,,1648921968,,,,Tweet,1510314317484339200,
,,CZ  Binance,"Unreasonable restrictions in local economies often cause talent drain. Smart young kids can and will go work in other countries, further weakening the local economy. It causes a vicious cycle that may take decades to reverse.",,,,1648915702,,,,Tweet,1510288036386455552,
,,CZ  Binance,Happy #Ramadan to all those celebrating this month!,,,,1648906612,,,,Tweet,1510249910544781312,
,['https:\\/\\/t.co\\/M7PVROOcDh'],CZ  Binance,The Builder: How @Binance Product Lead Mayur Kamat is Helping Build The Future of Web3 | Binance Blog,,,,1648894476,,,,Tweet,1510199008148475904,
,,CZ  Binance,Zoom out. You don’t just live in a city or country. You live on a little ball called Earth.,,,,1648861469,,,,Tweet,1510060569365295104,
,,CZ  Binance,"Might buy some fiat today, looks like a decent investment?",,,,1648840244,,,,Tweet,1509971544683991040,
,['https:\\/\\/t.co\\/KKMvfBh5Af'],CZ  Binance,An eye opener,,,,1648822598,,,,Tweet,1509897531400073216,
,['https:\\/\\/t.co\\/k5x0Q9tnFd'],CZ  Binance,Recording Academy Partners With ⁦@binance⁩ For The 2022 GRAMMYs,,,,1648794148,,,,Tweet,1509778204592066560,
,,CZ  Binance,Will be off Twitter for a while.,,,,1648778739,,,,Tweet,1509713573433548800,
,,CZ  Binance,"A few traditional media friends (from Bloomberg, FT, Fortune) all said their crypto articles are the most read. Probably nothing.",,,,1648709386,,,,Tweet,1509422686560309248,
,,CZ  Binance,"Really not that rich, but honored to be featured on the cover.  @FortuneMagazine",,,,1648708481,,,,Tweet,1509418888378867712,
,['https:\\/\\/t.co\\/RqJVtRJJ8z'],CZ  Binance,"Wow, damn… Not easy playing defense. Apple, Meta Gave User Data to Hackers With Forged Legal Requests (AAPL, FB) - Bloomberg",,,,1648666339,,,,Tweet,1509242130916651008,
,['https:\\/\\/t.co\\/NWx9mGdC9A'],CZ  Binance,"Why Bitcoin Mining Is Great for The Planet | by Jason Deane | Quantum Economics | Mar, 2022 | Medium",,,,1648664883,,,,Tweet,1509236024253325312,
,['https:\\/\\/t.co\\/tVwRsAMWod'],CZ  Binance,"A: @Binance already has the lowest fees in the market, why lowering it again?Me: because we can. Protect users.",,,,1648656532,,,,Tweet,1509200997893263360,
,,CZ  Binance,Crypto is terrible for avoiding sanctions for a simple reason. It is traceable.Cash on the other hand...,,,,1648631553,,,,Tweet,1509096228784594944,
,,CZ  Binance,Interns let loose at #BinanceBlockchainWeek,,,,1648629309,,,,Tweet,1509086819224281088,
,['https:\\/\\/t.co\\/byNCejNJmv'],CZ  Binance,#Binance launches Binance Bridge 2.0 to integrate CeFi and DeFi,,,,1648616849,,,,Tweet,1509034555365277696,
,,CZ  Binance,"Tried to subscribe to an online magazine (to read an article), but the payment process took way too long. If they just accepted crypto, they would have had my $108 for the year.",,,,1648600596,,,,Tweet,1508966384994340864,
,,CZ  Binance,Our team is in touch with AxieInfinity team providing assistance in tracking this issue.,,,,1648577455,,,,Tweet,1508869326916530176,
,,CZ  Binance,Love being on a panel with people with different views. Learned a lot.,,,,1648540919,,,,Tweet,1508716084261756928,
,,CZ  Binance,"Too many people spend too much time being jealous of other people's success, instead of working on their own initiatives. The latter is the only way out.",,,,1648540700,,,,Tweet,1508715164060762112,
,['https:\\/\\/t.co\\/nHNMCGzYLp'],CZ  Binance,"Win the heart of the users, then you win.",,,,1648531672,,,,Tweet,1508677299910103040,
,,CZ  Binance,"The video is a community contribution, I think. Got it in a message.",,,,1648506438,,,,Tweet,1508571459400183808,
,,CZ  Binance,"If you sold #BTC under $50,000.",,,,1648506415,,,,Tweet,1508571361039507456,
,,CZ  Binance,Understated the number.,,,,1648506169,,,,Tweet,1508570331849633792,
,,CZ  Binance,#BinanceBlockchainWeek,,,,1648489368,,,,Tweet,1508499864396701696,
,,CZ  Binance,Imagine if a country pushed out all their internet talent 20 years ago...Keep your blockchain talent.,,,,1648480813,,,,Tweet,1508463978950934528,
,,CZ  Binance,"Some lead, some follow. All happy.",,,,1648480367,,,,Tweet,1508462111516774400,
,,CZ  Binance,"Not a tax expert, but as far as I know, most countries have 0 tax for crypto transactions (transfers) today.",,,,1648479972,,,,Tweet,1508460454628274176,
,,CZ  Binance,"There were $10 in bitcoin transactions yesterday. You start to tax 30% today, how much tax will you collect today? Close to 0. Why?There were 10 birds in the tree. Bang, you shoot one down. How many birds are there left in the tree?",,,,1648479661,,,,Tweet,1508459147418820608,
,['https:\\/\\/t.co\\/otMYiduCqs'],CZ  Binance,Welcome to #Dubai!,,,,1648479301,,,,Tweet,1508457639990239232,
,,CZ  Binance,"Real estate and listed companies are ""safer than crypto"", right?This is the stock price of a top listed real estate company in China. 95% drop over 5 year.",,,,1648474257,,,,Tweet,1508436480993247232,
,,CZ  Binance,Self custody wallets are the future. #BNB,,,,1648470061,,,,Tweet,1508418884457619456,
,['https:\\/\\/t.co\\/9mSjznOrTP'],CZ  Binance,"A small culture reminder. Don't cross your legs on stage, so that you won't show the soles of your feet. Every culture have their etiquettes.",,,,1648467895,,,,Tweet,1508409799515463680,
,['https:\\/\\/t.co\\/Jsgvt0Wi8G'],CZ  Binance,Watching the livestream:,,,,1648466354,,,,Tweet,1508403336243994624,
,,CZ  Binance,Imagine not having crypto.,,,,1648425279,,,,Tweet,1508231052447436800,
,,CZ  Binance,#BinanceBlockchainWeek,,,,1648416065,,,,Tweet,1508192407468314624,
,,CZ  Binance,"And don't let others tell you what to think. 99% of what they say are their own opinions, which are almost never 100% correct. They are affected by context and intentions.Think for yourself.",,,,1648404906,,,,Tweet,1508145602617561088,
,,CZ  Binance,Don't tell people what to think.DO things to win their hearts.#bitcoin never tells you what to think.,,,,1648404485,,,,Tweet,1508143838103314432,
,,CZ  Binance,You can just tell people what to think. You have to DO things win their hearts.#bitcoin never tells you what to think.,,,,1648404423,,,,Tweet,1508143577385291776,
,,CZ  Binance,The video is from @Perridonhldgs,,,,1648385733,,,,Tweet,1508065185218678784,
,,CZ  Binance,Video from @mperridon,,,,1648380992,,,,Tweet,1508045298848968704,
,,CZ  Binance,,,,,1648379523,,,,Tweet,1508039140226617344,
,,CZ  Binance,"Entrepreneurship and crypto are both physical jobs. When combined, exponentially so.",,,,1648334701,,,,Tweet,1507851140876144640,
,['https:\\/\\/t.co\\/jzRJVBU1kf'],CZ  Binance,#EduFi #BNB,,,,1648332174,,,,Tweet,1507840543216254976,
,,CZ  Binance,"Covid sucks, missing out.",,,,1648317012,,,,Tweet,1507776947975249920,
,,CZ  Binance,"9 days ago, I made a handshake deal with mayor @eduardopaes. Rio De Janeiro will accept crypto for tax payments, and @Binance will open an office in Rio. He's done his part. We are working on ours.",,,,1648309343,,,,Tweet,1507744783795724288,
,,CZ  Binance,"But I am overall ok, still on Twitter.",,,,1648279929,,,,Tweet,1507621410528800768,
,,CZ  Binance,"Only arrived back in Dubai last night, lots of people to meet. Need to recover quickly.",,,,1648279360,,,,Tweet,1507619023311224832,
,,CZ  Binance,Shit… bad timing.,,,,1648277966,,,,Tweet,1507613178599030784,
,,CZ  Binance,"Need to learn Spanish, and Portuguese.",,,,1648272704,,,,Tweet,1507591106040680448,
,,CZ  Binance,"Need to learn Spanish, and Portuguese.",,,,1648272704,,,,Tweet,1507591106040680448,
,,CZ  Binance,Heard you’re in Dubai?,,,,1648246482,,,,Tweet,1507481123722600448,
,,CZ  Binance,"Wasting people’s time is as bad as taking their money, don’t do it. Be efficient.",,,,1648246184,,,,Tweet,1507479876046974976,
,,CZ  Binance,"Many countries want to embrace the new technology for money, crypto.",,,,1648239662,,,,Tweet,1507452520355930112,
,,CZ  Binance,"Effects of “banning” bitcoin mining. Bitcoin hash rate new ATH, higher than when the “ban” happened.",,,,1648206268,,,,Tweet,1507312455311138816,
,,CZ  Binance,@nayibbukele,,,,1648173728,,,,Tweet,1507175972344324096,
,['https:\\/\\/t.co\\/ouUZdIpmjZ'],CZ  Binance,,,,,1648173648,,,,Tweet,1507175638842683392,
,,CZ  Binance,"Don’t have pic on my phone. Coming soon, I am sure.",,,,1648173614,,,,Tweet,1507175493627518976,
,,CZ  Binance,"Didn’t talk about bond at all, the word never came up. But so much to talk about. #adoption.",,,,1648173471,,,,Tweet,1507174893930094592,
,,CZ  Binance,Fantastic meeting.,,,,1648173429,,,,Tweet,1507174719015034880,
,,CZ  Binance,Crypto pays the world.,,,,1648159949,,,,Tweet,1507118177460932608,
,,CZ  Binance,#BNB  Coinbase,,,,1648156652,,,,Tweet,1507104350400880640,
,,CZ  Binance,"Had the pleasure of meeting President @LuisLacallePou of Uruguay a few days ago. Strong, confident and very chill. I gave him my card, and he just held it like that.  Discussed high level blockchain, economy, etc. No specifics, no endorsements.",,,,1648147399,,,,Tweet,1507065542351466496,
,,CZ  Binance,My idol,,,,1648133638,,,,Tweet,1507007820960464896,
,,CZ  Binance,My idol!,,,,1648132024,,,,Tweet,1507001052784168960,
,,CZ  Binance,"It always feels like ""I am late"" in crypto. But we are still in the early days.",,,,1648092624,,,,Tweet,1506835798309625856,
,,CZ  Binance,"Man, the number of scam/spam comments...",,,,1648092147,,,,Tweet,1506833797874167808,
,,CZ  Binance,Keep building. #BNB,,,,1648092089,,,,Tweet,1506833554143158272,
,,CZ  Binance,Bitcoin doesn’t force you to do anything.,,,,1647991398,,,,Tweet,1506411224015286272,
,,CZ  Binance,Tried to get a finance/economics book as a gift for a teenager.Guess what? They don't exist.,,,,1647965775,,,,Tweet,1506303753888141312,
,,CZ  Binance,Stating the obvious: it's hard to be rich if you don't understand money.,,,,1647964826,,,,Tweet,1506299775171407872,
,,CZ  Binance,,,,,1647920526,,,,Tweet,1506113968330444800,
,,CZ  Binance,Argentina,,,,1647894222,,,,Tweet,1506003638895869952,
,,CZ  Binance,"If you don't understand #bitcoin, you don't understand money.",,,,1647808227,,,,Tweet,1505642952311324672,
,,CZ  Binance,The moon in Rio.,,,,1647719749,,,,Tweet,1505271845439918080,
,,CZ  Binance,Let’s grow Rio with crypto.,,,,1647718282,,,,Tweet,1505265694551810048,
,,CZ  Binance,Rio is beautiful!,,,,1647718279,,,,Tweet,1505265682186969088,
,,CZ  Binance,"For each grudge you let go, you achieve 2x more in life.",,,,1647641472,,,,Tweet,1504943529080066048,
,,CZ  Binance,"GM, love the colors!",,,,1647623718,,,,Tweet,1504869064849690624,
,,CZ  Binance,#Binance,,,,1647619433,,,,Tweet,1504851091837624320,
,,CZ  Binance,"Binance Custody is a crypto wallet for institutions, with multiple approvers, insurance, etc that fits corporate needs.",,,,1647614760,,,,Tweet,1504831491729145856,
,,CZ  Binance,.@BinanceArabic sponsored the first-ever NFT event in Bahrain this week. #TeamBahrain,,,,1647597464,,,,Tweet,1504758947928068096,
,,CZ  Binance,This week so far:@Binance gets Bahrain License@Binance gets Dubai License@BinanceUS gets Louisiana License@Binance to acquire brokerage in BrazilIt's only Thursday. Build.,,,,1647553427,,,,Tweet,1504574241156521984,
,,CZ  Binance,"It doesn’t matter who we blame for inflation, the fact is, it is here. What will you do about it?#btc has no inflation. #bnb is deflationary.",,,,1647528884,,,,Tweet,1504471301993349120,
,,CZ  Binance,“Let me give you my key ”from mayor of Rio…  ⁦@eduardopaes⁩ Rio de Janeiro on blockchain.,,,,1647526405,,,,Tweet,1504460904280346624,
,['https:\\/\\/t.co\\/gLi1HccPlP'],CZ  Binance,Bridging DeFi and CEX.,,,,1647523124,,,,Tweet,1504447142957654016,
,['https:\\/\\/t.co\\/S8WrsgUfHo'],CZ  Binance,Bridging tradifi and crypto.,,,,1647522882,,,,Tweet,1504446124958134272,
,,CZ  Binance,"I spent a bit of time taking selfies with some of our strongest supporters, where are the photos?",,,,1647482851,,,,Tweet,1504278225844850688,
,,CZ  Binance,"When people read about you in the news, they doubt you. When they meet you in person, they like you.",,,,1647482580,,,,Tweet,1504277089096249344,
,['https:\\/\\/t.co\\/geEx1kK4zP'],CZ  Binance,#Binance just mentioned on the Barbados 2022 budget by Prime Minister Mia Mottley @miaamormottley. Thanks to efforts of @SirBitt,,,,1647299484,,,,Tweet,1503509128316174336,
,['https:\\/\\/t.co\\/vlYepjVHy9'],CZ  Binance,#Binance Wins First Gulf Crypto License From Bahrain,,,,1647290439,,,,Tweet,1503471188839911424,
